;20030221.jpg;UN TOQUE DE ATENCION PARA LA SOLUCION ARGENTINA DE LOS PROBLEMAS ARGENTINOS  Viernes Precio en Capital Federal 21 de febrero y GBA: $ 1,40 + Recargo de 2003 envío al interior: $ 0,30 + Uruguay: $ 30 + Brasil: RS 6,00 Paraguay: G$ 8.000 Buenos Aires  Precios de opcionales, en  República Argentina .S ES elíndice de la página 2  Año LVIIl N? 20.510  Coleccionable Enciclopedia Yet.  ARGENTINA  El lugar más frío del Universo E »-Lo descubrió el Hubble. Es una  nebulosa de la constelación de “ Centauro. Allí hay 272" bajo cero.  PAG. 30  Cyber-chabones »Ya forman una  ¿Tpizza, birra y mouse. SUPLEMENTO S!  subcultura que vive a  —  Nace una estrella e »Habla la india Norah Jones, a los 23 años, revelación del jazz. e (E CLARIN ESPECTACULOS  »DATOS OFICIALES SOBRE ASALARIADOS  La mitad de la gente gana  $ 400 o menos  »Son casi 4,5 millones de personas. Aunque son los mismos ingresos de octubre del 2001, el poder adquisitivo es mucho menor. Con $ 400 sólo se cubre el 55% de la canasta básica de alimentos y servicios. El menor nivel de ingresos se da en el Nordeste, con $ 280 promedio, y el mayor, en la Patagonia, con $ 500. pac. 16  »REPORTAJE DE CLARIN  Crimen del country: ¿más de un asesino?  »El jefe de los fiscales bonaerenses cree que en el crimen de García Belsunce participó más de una persona. Dijo que eso surge de las pruebas halladas en la casa. Y que el caso estaría resuelto si hubieran dejado actuar a la Policía. PAG. 40  »Los acusados de encubrimiento buscan seguir libres  > INFRACCIONES DE TRANSITO El regreso  de las multas fotográficas  >El polémico sistema volverá a pleno. El Gobierno porteño ya renegoció el contrato. A partir de ahora les dará instrucciones a las empresas sobre qué calles y en qué horarios deberán controlar. PAG. 28  CUANDO FUNCIONARAN LAS CAMARAS  (2) Estacionamiento 7 a 21 Y Luz roja 24 hs Velocidades máximas 7 a 21  > INCREIBLE CASO EN ROSARIO  Mató a su hija porque  pr  GUSTAVO GARELLO / CLARIN el  volvió tarde  »-La chica tenía 19 años. Fue a quemarropa. El padre dijo que le dispararon desde la calle. Pero luego reconoció que tiró por “accidente”. No toleraba que volviera tarde. PAG. 42  HERMANADOS POR EL GOL. EZEQUIEL GONZALEZ Y DELGADO SE ABRAZAN DESPUES DEL GOL, QUE TARDO PERO ABRIO EL CAMINO A LA VICTORIA.  PLE GANO 2 A O A INDEPENDIENTE MEDELLIN  Boca ya se metió en la Copa  > Anoche, en la Bombonera, el equipo de Bianchi no brilló pero venció claramente a los colombianos. Los goles, Equi González —la figura— y Delgado. Abbondanzieri atajó un penal y el Mellizo Guillermo se fue expulsado. PAG. 45  FRASE DEL DIA MANUEL PELLEGRINI, DT DE RIVER, SOBRE LA ACTUACION DEL EQUIPO: “SI LOS RESULTADOS NO SE DAN, UNO VA PERDIENDO UN POQUITO DE AUTORIDAD”. PAG. 48 
;20030222.jpg;UN TOQUE DE ATENCION Sábado Precio en Capital Federal PARA LA SOLUCION 22 de febrero y GBA: $ 1,30 Recargo ARGENTINA DE LOS de 2003 envío al interior: $ 0,30 PROBLEMAS ARGENTINOS + Uruguay: $ 30 + Brasil: RS 6,00 » Paraguay: G$ 8.000 Buenos Aires República Argentina | Piecios de opcionales, en Año LVIII N* 20.511 — | el índice de la página 2  Otro golpe al campeón El humor de Clooney | Hoy, cupones Dm La vuelta al cole ¡TÍ » Independiente perdió su segundo o p »-Clarín lo entrevistó en | »Están en Clarín y » Guía de compras  partido consecutivo en el Clausura. | ¿. ** + Berlín y el actor no paró | sirven para acceder ff a! completa con los Gimnasia lo aplastó por 3 a O. e de reírse de sí mismo. | a un Diccionario. / 7 mejores precios. E | E »  CLARIN DEPORTIVO ñ CLARIN ESPECTACULOS | PAG. 51 | SUPL. CHICAS 8: CHICOS  >» MENEM, KIRCHNER Y RODRIGUEZ SAA »ESCANDALO EN SALTA  Investigan si  Nad le pod rá es hija de  Hoyos una  usar sim bolos chica violada  estaba con Hoyos en un motel. La adolescente dijo que a ella también  m la había violado. El juez sospecha que el abogado podría ser el padre. Y ordenó exámenes de ADN. PAG. 28  »Se desprende de un fallo de la jueza electoral que prohíbe a Menem utilizar la Aborto terapéutico a  palabra “peronista” en el frente que impulsa su candidatura. Servini dice que el usO | na nena embarazada “por parte de más de una agrupación de la misma simbología” puede confundir al | ¿Es nicaragiiense, tiene 9 años y fue electorado. Anticipa así que tampoco autorizará a Kirchner y a Saá. paas. 12 Y 13 violada. El caso trajo polémica. PAG. 34  AR  Nube de miedo en Nueva York  »Una inmensa columna de humo se cierne sobre Manhattan. Fue por la explosión que incendió una refinería frente a la ciudad. Se trató de un accidente, pero hubo terror porque todos pensaron en  ro atentado. PAG. de JN . otro atentado. PAG. 27  SURUEMENTO/GUETURA » HAY 180 HERIDOS » DESTRUCCION DE ARMAMENTO  El pensamiento Incendio en una disco Una orden de antibelicista de EE.UU.: 95 muertos |!a ONU a Irak  »-El pensador italiano Massimo »Le dio plazo hasta el 1% de marzo Cacciari, a las puertas de una nueva | »Fue en Rhode Island, a 200 km de Nueva York. En la noche del jueves, para que comience a destruir un tipo guerra, habla de la paz como teoría | mientras tocaba un grupo de rock, tiraron fuegos artificiales. Pero el techo | de misiles. Si no lo hace, EE.UU.  política y valor utópico. del club era inflamable y el local se quemó en pocos minutos. Pacs. 26 Y 27 | probará que Irak no coopera. PAG. 22  FRASE DEL DIA ANNE KRUEGER, VICEPRESIDENTA DEL FMI: “LAS RELACIONES ENTRE LA ARGENTINA Y EL FONDO AHORA PASAN POR UN BUEN MOMENTO”. PAG. 7 
;20030223.jpg;| Racing, con  Hoy Coria se  El nuevo diseño argentino  juega todo »-Cómo la creatividad le lo justo  ganó a la crisis. Las > Volvió a ganar , qn razones de un E en el torneo, de la Copa ATé.T fenómeno que / esta vez 1-0 a contra Moya. va por más. — $ Arsenal. PAGS. 72 Y 73 REVISTA VIVA | PAGS. 53 A 55  Mirada ácida sobre Bush »El escritor Gore Vidal y las razones oscuras de la guerra, SUPL. ZONA  vw  IN-TOQUE DE ATENCIÓN PARA LA SOLUCIÓN ARGENTINA DE LOS PROBLEMAS ARGENTINOS:  LA CARRERA ELECTORAL  Scioli irá como candidato a vice de Kirchner  | En las últimas 48 horas Kirchner y Scioli terminaron de cerrar el acuerdo. Apuntan a sumar los votos independientes. Así ya están definidas las tres fórmulas peronistas. Pacs. 3.A 11  ne el aval de Di  le  PANORAMA POLITICO EDUARDO VAN DER KOOY  »Una jugada audaz pero también riesgosa. pac. 26  CARLOS CARRION / CLARÍN. Ñ  BOMBEROS ANTE LOS RESTOS EL MICRO. EL PRIMER: PISO QUEDO SECCIONADO..  »HAY 22 HERIDOS  Tragedia en un micro: 10 muertos  »Fue en la madrugada de ayer a 25 kilómetros de Rosario camino a Córdoba. Según los sobrevivientes, el chofer iba muy rápido. Hizo una maniobra brusca, se desbarrancó, dio varias vueltas y cayó en un zanjón. PAGS. 38 Y 39  Precio en Capita] Federal Y GBA: $:2,80 + Recargo  23 de febrero  de 2003 envío al interjor: $ 0,30 + Uruguay, $40 + Brasil, R$:8,00 + Paraguay: $11,000  Buenos Alles  Precios de opcionales, en el indice de-la página 2  República Argentina Año: LVIIN20:542  >-EL ASESINATO DE “DALLAS”  Los planes con los que Conzi busca salvarse  »-Primero, el empresario prófugo intentará demoler las sólidas pruebas en su contra. Si fracasa, aducirá demencia en el contexto de un crimen pasional. Buscaría ser declarado inimputable, PAG. 42  »EL CASO GARCIA BELSUNCE  Crimen del country: una rara llamada  »-Se realizó desde la casa de María Marta 40 minutos después de que su marido hallara el cuerpo. Y fue detectada con un nuevo sistema de rastreo telefónico. El destinatario: un abogado penalista, PAG. 41  REPORTAJE EXCLUSIVO  Nicole Kidman, pura pasión  Le dijo a Ml Clarín que su  rabajo es “peligroso, intoxicante y emocionante”. Y que no le importó afearse para interpretar a Virginia Woolf. CLARIN ESPECT.  FRASE DEL DIA DAVID NALBANDIAN ,TENISTA, SOBRE LOS ESFUERZOS QUE DEBE HACER UN DEPORTISTA: “SACRIFICADO ES CARGAR BOLSAS EN EL PUERTO”. REVISTA VIVA 
;20030224.jpg;UN TOQUE DE ATENCION PARA LA SOLUCION ARGENTINA DE LOS PROBLEMAS ARGENTINOS  Se acabó la sequía  » »Batistuta hizo un gol  * después de 99 días. El Inter ganó y está puntero. CLARIN DEPORTIVO  No a “cargos adicionales” »La Justicia ordenó que no se cobren honorarios extras  en las tarjetas de crédito. PAG. 28  Lunes Precio en Capital Federal 24 de febrero y GBA: $ 1,30 Precio en de 2003 Capital Federal y GBA con  Diario de Arquitectura: $ 1,50 » Recargo envio al interior: $ 0,30 Uruguay: $ 30 + Brasil: R$ 6,00 Paraguay: G$ 8.000 Precios de opcionales, en el índice de la página 2  Buenos Aires República Argentina Año LVIII N* 20.513  Hacé la primera Hoy, las cartas para jugar otra mano con Clarín. PAG. 33  RICARDO ALFIERI/ CLARÍN  Á  PURA SOLEDAD. MANUEL PELLEGRINI, AYER, POCO ANTES DEL GOL DE NANNI, MAS TARDE ASEGURO QUE NUNCA PENSO RENUNCIAR.  » RACING Y VELEZ SON UNICOS PUNTEROS DESPUES DE LA SEGUNDA FECHA  Vélez y Unión amargaron a River y Boca  » En un partido que parecía un empate clavado, Vélez ahondó la crisis de River al ganarle 1-0 en tiempo de descuento. No vencía en el Monumental desde 1990. Pellegrini fue muy insultado. Luego, el equipo de Bianchi cayó con justicia ante Unión 2-0. Hacía 19 años que no era derrotado en Santa Fe. cLarin DEPORTIVO  ] z kh:  >  » AMENAZA DE ATAQUE A IRAK  El Papa pide ayunar contra la guerra  »Convocó a los 1.100 millones de católicos a un día de ayuno el 5 de marzo, Miércoles de Ceniza. Y llamó a que se sumen otras religiones. Remarcó que en la jornada se rezará por “la paz, especialmente en la zona de Oriente Medio”. PAG. 24  JUAN PABLO Il, AYER: OTRA INICIATIVA PACIFISTA.  >» GOBIERNO DE LA CIUDAD  Proponen a Lavagna en Capital  »Duhalde le ofreció ser candidato. Es porque Scioli, que ayer ganó la interna del PJ en Capital, irá como vice de Kirchner. Y así deja vacante la candidatura a jefe de Gobierno porteño. Lavagna lo pensará. PAG. 3  »EL CRIMEN DEL COUNTRY  El abogado reconoce que lo llamaron  »Es Jorge Scelzi, defensor de tres parientes de María Marta García Belsunce. Dice que lo llamaron 40 minutos luego del crimen, pero como amigo. Scelzi es penalista. PAG. 35  LEOPOLDO MOREAU, CANDIDATO RADICAL: “LO IMPORTANTE ES CONVENCER A NUESTROS PROPIOS DIRIGENTES QUE TODAVIA TENEMOS ALGO”. PAG. 8 
;20030225.jpg;UN TOQUE DE ATENCION Martes Precio en Capital Federal PARA LA SOLUCION 25 de febrero y GBA: $ 1,40 + Recargo ARGENTINA DE LOS de 2003 envío al interior: $ 0,30  + Uruguay: $ 30 » Brasil: PROBLEMAS ARGENTINOS. R$ 6,00 » Paraguay: G$ 8.000  Buenos Aires República Argentina | Precios de opcionales, en  Año LVINN> 20.514 [elíndice de la página 2  0 Logro científico trascendente »Con George Romero, » Médicos argentinos descubren director de La noche de E la función de la poco conocida los muertos vivos. CS | quinta cavidad del corazón. CLARIN ESPECTACULOS 1 PAG. 27  »Pero, ¿es el Único culpable? ¿Qué pasa ¡con los jugadores?  PAGS. 37. A 39  »LO RECONOCE UN INFORME OFICIAL DE LA JEFATURA DE GABINETE >UNA RARA CADENA CRIMINAL  Es calamitoso comisario  el estado de 3 iemasiaco  había desaparecido hace 10 días. Investigaba la muerte de un  subcomisario, que a su vez seguía el caso de la Aduana paralela. Lo encontraron con una bala en la  cabeza. ¿Crimen mafioso? Pac. 24  »Son los ex ferrocarriles Roca, Belgrano Sur y Sarmiento, que administran las Las empresas Metropolitano y TBA. El informe dice que más del 60% de los asientos nt 1e  y las ventanillas están rotos. Y admite que se debería aumentar en un 30% el >Vuelvén a hablarde'Tobo, Se personal de seguridad en vagones y andenes. Ahora debe decidir Duhalde. pac. 12 | basan en sus propios peritos. pas. 25  »A DIAS DEL CARNAVAL  En Río se desató el terror de los narcos  »-El Comando Vermelho, la fuerza de choque de los narcos en la ciudad, quemó autos y micros, hizo cerrar negocios y atacó a tiros edificios públicos. Aparentemente quieren la libertad de su jefe, que está preso. Playas como Ipanema, Tijuca y Botafogo quedaron desiertas por el miedo. PAG. 30  ESCENARIO ELEONORA GOSSMAN »Un grupo de choque al Napa  a 5 e ALA HL e MM A a de que la policía le tiene miedo BAJO FUEGO. BOMBEROS DE RIO DE JANEIRO INTENTAN CONTROLAR LAS LLAMAS DE UN MICRO INCENDIADO EN EL BARRIO DE BOTAFOGO.  » ASEGURA QUE IRAK YA PERDIO SU ULTIMA OPORTUNIDAD » HALLAZGO DE CIENTIFICOS JAPONESES  ” YA n Y 69) Otro ultimátum de Bush |¡¿Vacuna contra la ulcera”? »EE.UU. dijo en Naciones Unidas que Saddam no cumplió la resolución »-Consiguieron aislar el componente de la bacteria que produce la úlcera  que lo obliga a dasarmarse. Lo apoyaron Gran Bretaña y España. Pac. 20 estomacal. Creen que es un gran paso para desarrollar una vacuna. PAG. 31  FRASE DEL DIA ANIBAL FERNANDEZ, MINISTRO DE LA PRODUCCION, SOBRE EL AUMENTO DE LAS NAFTAS: “SE PUEDE RESOLVER POLITICAMENTE CON LAS PETROLERAS”. PAG. 14 
;20030226.jpg;UN TOQUE DE ATENCION PARA LA SOLUCION ARGENTINA DE LOS PROBLEMAS ARGENTINOS  El sello de la mafia »Para matarlo, a! comisario Piazza lo  Vuelve el crédito hipotecario »El Ciudad restableció esos préstamos en pesos, a 5 años. Lo anunció Ibarra, en campaña. PAG. 15  io de un chef El francés Loiseau ño toleró que bajaran la nota a su restorán.  hicieron arrodillar. PAG. 33  »ANTES, UN FALLO JUDICIAL LAS HABIA ANULADO Y OTRO LAS AVALO  Frenan otra vez las subas de luz y gas  »Según una jueza, no se pueden hacer por decreto. El alza era de 9% para la luz y de 7% para el gas, en promedio. Economía quería avanzar con otros ajustes y ahora apelaría. El aumento lo exige el FMI. pac. 12  Trenes: emplazan a la línea Roca  »-El Gobierno le dio veinte días para que mejore el servicio. PAG. 14  Miércoles Precio en Capital Federal 26 de febrero y GBA: $ 1,30 » Recargo de 2003 envío al interior: $ 0,30 + Uruguay: $ 30 + Brasil: RS 6,00 » Paraguay: G$ 8.000 Buenos Aires  Precios de opcionales, en  República Argentina is A elíndice de la página 2  Año LVII N” 20.515  Madariaga: la furia no para »La gente sigue reclamando más seguridad y atacó la casa del intendente, que es del PJ. PAG. 32  Estatiza la Ciudad la autopista Arturo lllia  » Desde que se habilitó en 1995 fue privada. Son tres kilómetros y cuesta un peso. El Gobierno porteño argumentó irregularidades en el contrato vigente y quiere bajar el peaje a la mitad. La empresa apelará y mientras tanto hay pase libre. PAG. 19  »Los combustibles no subirían hasta el próximo gobierno ac. 1  Un desalojo E terminó ¡ en batalla campal  »Lo ordenó un juez por el peligro de derrumbe. Las 40 familias que quedaban se resistieron. Pero más de 200 policías las sacaron. En las calles de San Telmo hubo gases, tiros y pedradas. Se sumaron piqueteros, estudiantes y una asamblea barrial. PAGS. 26 A 29  »Violenta agresión de la Policía a dos eriodistas de tevé  »A LOS 82 AÑOS MURIO ALBERTO SORDI FE  m7 A Adiós a un cómico genial “>, »Sus gags fueron célebres en el mundo. Conservador, romano típico, 4 en Italia lo llamaban “Albertone nazionale”. CLARIN ESPECTACULOS Ñ  AXEL ALEXANDER /CLARIN  ASI EMPEZO TODO. LA ESCENA, AYER AL. MEDIODIA. DESPUES, LA TENSION DIO PASO ALA VIOLENCIA. EL SALDO: 14 HERIDOS Y 79 DETENIDOS.  > VICTORIA CLAVE POR LA COPA LIBERTADORES  Racing sigue de fiesta  >Le ganó 2-1 a Nacional en el Centenario, se afirmó como líder de su grupo y además puntea en el Clausura. PAG. 41  FRASE DEL DIA NESTOR KIRCHNER, AL PRESENTAR A DANIEL SCIOLI, SU COMPAÑERO DE FORMULA: “NO NOS INTERESA HABER TENIDO TRAYECTORIAS DIFERENTES”. PAG. 3 
;20030227.jpg;UN TOQUE DE ATENCION PARA LA SOLUCION ARGENTINA DE LOS PROBLEMAS ARGENTINOS  Jueves Precio en Capital Federal 27 de febrero y GBA: $ 1,30 » Recargo de 2003 envío al interior: $ 0,30 + Uruguay: $ 30 + Brasil: RS 6,00 » Paraguay: G$ 8.000 Buenos Aires  Precios de opcionales, en  República Argentina .S ES elíndice de la página 2  Año LVIIl N? 20.516  Londres: un juez lo hizo papá »Por error inseminaron a una mujer blanca con semen de un negro. Tuvo  Bien milonga Se larga Bs. AS. Tango. La historia del tango bailado. UPLEMENTO ESPECIAL  Más polémica por el ex Padelai » Un juez le ordenó al Gobierno de la Ciudad que pare la demolición. Fue a 24 horas del violento desalojo. PAG. 31  mulatos. Ahora el negro es el padre, PAG. 35  »EN EL GOBIERNO HAY INQUIETUD POR LAS CONSECUENCIAS  Redolarización: la Corte, cerca de un fallo clave  »Tiene decidido tratar el martes el caso del depósito de la provincia de San Luis en el Banco Nación, que era de 247 millones de dólares. Ya hay mayoría para fallar contra la pesificación. Pero no se fijaría ni el plazo ni la forma de devolución de los fondos. Esto abriría la puerta a un reclamo masivo de los ahorristas. Pac. 3  GUSTAVO GARELLO / Enviado especial  " dl  PARA USTED, MAESTRO. ALFREDO MORENO LE DEDICA A BIANCHI EL PRIMER GOL, QUE FUE DE PENAL. DESPUES MARCO EL DEL TRIUNFO. bLE GANO 2-1 AL COLO COLO POR LA LIBERTADORES  Boca también fue patrón en Chile  »Siempre fue superior. Y pudo ganar por más. Los chilenos igualaron con un penal polémico. Boca definió con un contraataque sobre el final. Después del partido, Schiavi debió ser operado de urgencia por una apendicitis.  Gimnasia barrió 5-1 al Alianza Lima y su sueño cre  Crece cuan ver.  Física argentina, premiada  » La UNESCO distinguió en París a Mariana Weissmann por sus estudios sobre la materia sólida. PAG. 30  »LA GUERRA SE APROXIMA  Bush dice que la  ocupación será larga  » Aseguró que las tropas de EE.UU. se quedarán en Irak “todo el tiempo que sea necesario”. Reiteró que la democratización de ese país será “un ejemplo inspirador para Oriente Medio”. Y prometió a los iraquíes equidad y bienestar. PAGS. 22 A 25  > Moriré con honor, asegura Saddam  »POR PROVINCIA DE BUENOS AIRES  8 ministros en la lista de diputados  »-Son Ruckauf, Alvarez, Atanasof, González García, Fernández, Doga, Graciela Camaño y Pampuro. La lista la encabezan Chiche y el jefe de Diputados, Camaño. PAG. 12  e  >El mendocino Gustavo Gutiérrez completa la fórmula del ARI. PAG. 17  »BUSCAN EL CRUCERO HUNDIDO  Revivir la tragedia del Belgrano  »El sábado parte una expedición de la National Geographic. Lleva a un sobreviviente y a 2 marinos británicos del submarino que lo hundió. Además va un buque de la Armada. PAG. 19  FRASE DEL DIA LUIS BARRIONUEVO, POR LAS TRABAS LEGALES A SU CANDIDATURA A GOBERNADOR DE CATAMARCA: “SI ME PROSCRIBEN, CONVOCAREMOS A LA GENTE A NO VOTAR”. PAG. 16 
;20030228.jpg;UN TOQUE DE ATENCION Viernes Precio en Capital Federal PARA LA SOLUCION 28 de febrero y GBA: $ 1,40 Recargo ARGENTINA DE LOS de 2003 her al curia $ le PROBLEMAS ARGENTINOS + Uruguay: $ 30 + Brasil: . " R$ 6,00 » Paraguay: G$ 8.000 Buenos Aires  Precios de opcionales, en  República Argentina 3 pe el índice de la página 2  Año LVIIl N? 20.517  e¿cóho se llama?  , hn Reilly el actor al que todos'conocen y no saben sú nombre.  CLARIN ESPECTACULOS  Michael, el careta La escandalosa vida de Jackson contada, sin ningún tapujo. SUPLEMENTO SI  El ejército, en el carnaval de Río  »-Lula ordenó que tres mil hombres | de las Fuerzas Armadas cuiden a  la gente del peligro de los narcos.  PAG. 40  lop ARGENTIN  >DESPUES DEL INFORME QUE RATIFICO QUE TRES LINEAS ESTAN EN ESTADO CALAMITOSO  Dan 40 días ara mejorar los ferrocarriles  »Las empresas concesionarias deberán presentar en 72 horas su plan para optimizar el servicio. La idea es que brinden un confort básico: asientos en buen estado, ventanillas con vidrios, puertas que cierren y estaciones en condiciones.  »PIDE AYUDA A LA JUSTICIA  La maestra con 6 hijos que ya no  puede más  > María Inés Pacheco vive en Paraná. Tiene hijos de 10, 7, 6 y trillizos de 5. Gana $ 600 y no cobra desde hace dos meses. Cuando se detectó que 5 de sus chicos tienen principio de desnutrición, le reclamó a un juez que les dé comida. Pa6s. 32 Y 33  »Para subsistir, los bomberos de Berisso  El Gobierno dejó de hablar de rescindir contratos, pero estudia sanciones. Pac. 12  venden 2 autobombas  »ES MONSEÑOR STORNI  Procesan por abuso a un ex arzobispo  »Era el jefe de la Diócesis de Santa Fe. Envuelto en un escándalo sexual, tuvo que renunciar en setiembre ante Juan Pablo Il. Ahora un juez lo acusa de abuso contra un ex seminarista. PAG. 48  » SUPLEMENTO ESPECIAL  ula total  LO tU a 590005 del ZUVU  >El campeonato arranca este fin de semana en San Luis. Hoy, gratis con Clarín, una radiografía completa de máquinas y pilotos.  l)  CHAU MUFA. LUCHO GONZALEZ GRITA SU ZAPATAZO, EL SEGUNDO DE RIVER. LO ABRAZA CLAUDIO HUSAIN. EL BICHI FUERTES HIZO LOS OTROS DOS.  >-EN NUÑEZ LE GANO 3-1 A LIBERTAD POR LA COPA  La noche en que River festejó  »-No jugó bien, pero fue superior al equipo paraguayo. Y logró quebrar una racha negativa de un empate y dos derrotas en el Clausura y la Libertadores. El triunfo bajó la tensión y le da oxígeno al técnico Pellegrini. Pas. 51 A 53  FRASE DEL DIA CARLOS RUCKAUF, CANCILLER: “ARGENTINA NO PARTICIPARA MILITARMENTE EN IRAK CON NINGUN TIPO DE AVIONES, DE BARCOS NI DE HOMBRES”. PAG. 14 
;20030301.jpg;yd UN TOQUE DE ATENCION Sábado Precio en Capital Federal PARA LA SOLUCION 1” de marzo y GBA: $ 1,30 Recargo ARGENTINA DE LOS de 2003 envío al interior: $ 0,30 PROBLEMAS ARGENTINOS + Uruguay: $ 30 + Brasil: RS 6,00 » Paraguay: G$ 8.000 Buenos Aires República Argentina | Piecios de opcionales, en Año LVIIN? 20.518 — | el índice de la página 2  Rugby argentino for export Se viene Feriagro »Ya hay 360 jugadores locales | »Es del 13 al 16, en en Europa. Un fenómeno que Junín. Todo lo que sólo es superado por el fútbol. hay que saber CLARIN DEPORTIVO CLARIN RURAL ESPECIA!  Unión baja a los grandes  » Después de ganarle a Boca, anoche venció a San Lorenzo 2-0 en el Nuevo Gasómetro. CLARIN DEPORTIVO  El hombre quieto Entrevista con Daniel Day Lewis, todo un personaje. CLARIN ESPECTACULOS  »SE LO ASEGURO A NACIONES UNIDAS  Saddam empieza a destruir misiles  »Anunció que comienza hoy mismo. Son los de largo alcance. Para el jefe de > Fuerte impacto en inspectores de la ONU esto significa un “desarme real”. La noticia descolocó a la opinión pública  EE.UU., que dijo que eso es secundario. Y ratificó que quiere echar a Saddam. p p 7 Alemania, Francia y Rusia, en cambio, elogiaron la decisión de Irak. paes. 26 a 29 de Estados Unidos  »>-DEL LUNES 3 AL VIERNES 7  El campo  va al paro contra los impuestos  »-Lo impulsan las entidades del sector, y también los exportadores y la industria aceitera. Paralizarán el comercio de granos, y eso puede empujar el dólar. Se quejan por la presión impositiva. PAG. 15  »La leche sube entre 7 y 10% vas. ss  SUPLEMENTO CULTURA  El hombre que  »Caseros, penúltimo capítulo»La escena, ayer, en el patio del penal. Empezaron a retirar equipos retrató la muerte y elementos contaminantes. En 4 meses, la demolición. Allí harán una escuela, parques y viviendas. PAG. 40  » Enrique Metinides es un fotógrafo de policiales mexicano bELECCION EN CATAMARCA »EXPERTOS ARGENTINOS LO DESCALIFICAN que duerme con la frecuencia policial encendida para llegar a  Todavía no votaron La estupidez tiene | temosiccenaceiormen. y ya hay escándalo |cura, dice un Nobel  » La Corte no aceptó un último pedido de Barrionuevo »Es uno de los descubridores del ADN. Afirma que A para ser candidato. La Justicia local eliminó su boleta. Y | con exámenes genéticos prenatales se puede prevenir. a  ahora el PJ dice que toda su lista fue proscripta. PAG. 6 Y dice que es un trastorno hereditario. PAG. 44 O e] FRASE DEL DIA ALFREDO ATANASOF, JEFE DE GABINETE, SOBRE LOS TRENES: “NINGUN CONTRATO DICE QUE PARA IR EN TREN HAY QUE ABRIR UN PARAGUAS DENTRO SI LLUEVE”. PAG. 18  
