;20220528.jpg;Libertadores  Boca, ante Corinthians y River con Vélez  Sortearon los octavos para fines de junio  y aseguran un  equipo argentino  en semifinales.  P.58  : uncastillo 4 en Francia  Pablo ' Reinoso , Elescultory  P.34  Forzado por la inflación  Suben el piso de Ganancias  no pagarán quienes ganen hasta $280 mil por mes  El ministro Martín Guzmán anunció la suba del piso del impuesto a las Ganancias. Desdejunio, quedarán exentos los asalariados que cobren hasta $280.792 en bruto. Hasta ahora, ese piso era de  225.937 pesos y por las últimas paritarias habían comenzado a pagar 100 mil personas más. Se estableció, además, queel aguinaldo también quedará alcanzado por la rebaja. P.4  Foto Foto de unidad  Massa presionó y lo sumaron al anuncio.  EL AUMENTO EN LOS SERVICIOS  Por ahora, no habrá tarifas de gas y luz diferenciadas por ingresos  La Secretaría de Energía informó que las tarifas de gas suben 20% desdejunio y las de electricidad un 17%. En el cuadro tarifario no figura la segmentación para los usuarios de altos ingresos que el Gobierno había anunciado tras el acuerdo con el Fondo Monetario. P.28  MAURICIO NIEVAS  La UCR, por candidatos propios y ampliar Cambiemos  Votaron a Gastón Manes como presidente de la Convención. Es un gesto de respaldo a su hermano Facundo, probable precandidato presidencial. Detrás, hubo un acuerdo de Gerardo Morales, Martín Lousteau y Alfredo Cornejo. p.12  VUELOS Y PAQUETES TURISTICOS  Crecen los reclamos por los viajes cancelados en la pandemia  Enla Ciudad, la cifra es casi cinco veces mayor ala quesedaba hasta 2019. El 40% de las denuncias correspondenalascancelaciones oreprogramaciones de vuelos. Algunas ya llegarona la demandajudicial, perola mayoría prefiere acuerdos para la devolución del dinero. p.46  Los piqueteros descansan y cierra Raspa Investments  P.3  REPUBLICA ARGENTINA, AÑO LXXVIN' 27.473 RECARGO ENVIO AL INTERIOR: $ 30,00 PRECIO DE LOS OPCIONALES, EN EL ÍNDICE DE LA PÁGINA 66, 
;20220529.jpg;Peretti Sua Con la química del éxito  casas, los s! bena una  plataforma vi los cobran q  GAS Y ELECTRICIDAD  Guzmán dice  México dijo quenoirá  «uesegmentará  las tarifas, pero  alacontracumbreque  emosa:  cómo hacerlo  o ropuso la Argentina orcos y el gas que seimplementará enju nio será la única del año, pero aún faltan aplicar los aumentos segmentados según ingresos para sectores medios y altos. Aunque el Gobierno admite que no encuentra un meca Cumbre de las Américas  Alberto Fernández trabajó en un enla cita continental. El presidente de cuentro de la Celac -que él preside-en México, aliado de Fernández, descartó paralelo a la Cumbre de las Américas su asistencia a esa contracumbre y el  que organiza EE.UU., para protestar Plan de la Casa Rosada perdió peso. 4 ¡ nismo para ponerlos en práctica. 10 contra la decisión de Joe Biden de exAhora, el Gobierno busca bajar el perfil Fernández quiere Parap » cluira Cuba, Nicaragua y Venezuelade — de suiniciativa original. p8 COPlala Kirchner PROYECTO UNIFICADO e En . " Reyes. Un desbord | |Boleta Unica: la festejo en el Stade de France. eZ oposición se une y avanza, aunque . . el kirchnerismo  puede frenarla  En Diputados, los bloques opositores unifican posiciones en el proyecto y tratarán de sacar dictamen durante esta semana. El kirchnerismo apuesta a detener la movida en el Senado. Y también consideran que, en caso de convertirse en ley, sería vetada por el Presidente. p.10  DUPLICARON EN VOTOS A LOS K  Los radicales se  quedan con el  control dela FUBA El Liverpool no aprovechó sus chances en París y el arquero Courtois fue gran figura del equipo madrileño. Vinicius, el gol. Una militante de Lousteau la preY Ancelotti se consolida como el técnico más ganador en el historial de la competición europea: ya lleva cuatro títulos. p.62 sidirá los próximos dos años.p.55  REPUBLICA ARGENTINA, AÑO LXXVI N' 27.474 RECARGO ENVIO AL INTERIOR: $ 30,00 . PRECIO DE LOS OPCIONALES, EN EL ÍNDICE DE LA PÁGINA7A, 
;20220530.jpg;ClarínX  el Louvre  odetorta al más célebre lo salvó a la pintura. ra.  Un toque de atención para la solución argentina de los problemas argentinos  BUENOS AIRES, ARGENTINA PRECIO: $180.00  Inflación e inseguridad son las mayores preocupaciones  Para el 62% de la gente, Fernández está en el peor momento de su gestión  Así surge de una encuesta de Management 6. Fit, que midió el humor social, El 62,3% desaprueba la gestión de Alberto F,, y más del 60% considera que la situación general del países mala o muy mala. Los números están muy lejos de los que cose chóel Presidente en el arranque dela pandemia, con un apoyo del 57%. Los principales problemas para los consultadosen el AMBA son la inflación con el 37,1%, seguida por la inseguridad con 15,2% y el desempleo con 10,9%.p.8  La pelea presidencial  Juntos por el Cambio con ventaja en Ciudad, y paridad en Provincia  HABRÁ BALOTAJE  Colombia: ganó el ex guerrillero Petro y hubo sorpresa en el segundo lugar  El izquierdista Gustavo Petro se impuso en la primera vuelta de las presidenciales pero no le alcanzó para evitar el balotaje del 19 dejunio. Logró el 40,3% de los votos, seguido del empresario populista Rodolfo Hernández, con el 28,1%. El favorito para ese lugar era el oficialista Federico Gutiérrez, quien obtuvo 23,8%. TEMA DEL DIA P.3  Disparos en la madrugada. Dos policías con sus armas apuntando a la camioneta que manejaba el chico.  í  La persecución quecasi termina entragedia  Tomás Krúger, de l9años, intentó entrar al country de Moreno dondevive. Pero policías que lo perseguían lo encerraron y le dispataron en las piernas y en un brazo. Dijeron que había pasado un semáforo en rojo. Está internado y tienen que operarlo.r.38  CUMBRE DE LAS AMÉRICAS  AlbertoF. le prometió a Maduro defender  aCuba, Nicaragua y Venezuela ante Biden  El Presidente lo acordó con el chavista y también con el mexicano López Obrador. Aún debe definir si irá a la Cumbre organizada por EE.UU., luego de su fallida proPuesta de una contracumbre. P.16  TENSIONES EN LA ECONOMÍA  Adelantan el ajuste de los Precios Cuidados para evitar el desabastecimiento  Se iba a hacer en julio y ahora se hará en la primera semana de junio. El aumento sería de más de 3% y es Para que no haya faltantes. p.23  EN ARGENTINA Crecenlos casos de hipertensión, diabetes y cáncer en menores de 50  Especialistas advierten que están aumentando en el país las consultas por cáncer, diabetes o hipertensión, propias de gente de mayor edad, en quienes aún no alcanzaron el medio siglo de vida. Entre las principales causas que explican el fenómeno mencionan la mala nutrición, con exceso de car nesrojas, alimentos ultra procesados, altas cantidades de sal y azúcar y harinas refinadas, y pocas verduras y legumbres. Esto se suma al sedentarismo, la obesidad, el hábito del cigarrillo y el consumo de alcohol. El 41% de los chicos tiene problemas de sobrepeso u obesidad a partir delos 17años.p.32  DelaEditora  Silvia Fesquet  Esa compulsión argentina por violar la ley  14  REPUBLICA ARGENTINA, AÑO LXXVIN' 27.475 RECARGO ENVIO AL INTERIOR: $ 30,00 PRECIO DE LOS OPCIONALES, EN EL ÍNDICE DE LA PÁGINASO. 
;20220531.jpg;Planetario  Con todas las luces  Icono porteño, estrenó 360 luminarias Led que realzan su cúpula y permiten ahorrar energía. m2  Un toque de atención para la solución argentina de los problemas argentinos  BUENOS AIRES, ARGENTINA PRECIO: $180,00  Tema del día + Impacto en el bolsillo  Junio mete más presión alos precios: suben gas, luz, prepagas y alquileres  A partir de mañana aumentan 17% la electricidad y entre el 18% y el 25% el gas, lo que se verá reflejado en las boletas de julio. Para las prepagas el Gobierno autorizó una suba del 10%. Los  alquileres que venzan este mes treparán un 54%. Muchos colegios privados también subirán sus cuotas. En el caso del personal doméstico habrá un incremento del 15% y hasta los abonos  de Netflix registrarán un ajuste del 27,6%. Esto impactará en la inflación dejunio: economistas privados estiman que el índice de mayo rondará ya el 5%.p.3  NAD  53ENTIN) ZA  añ  SE  CAPTURA TV  NADO  ARGENTINA  SENAI  ARGENTI  Al Testimonio desgarrador. La madre de Chano habló ayer en el Congreso.  “No sé sicuando amanece vaa estarvivo”  Enel Senado, Marina Charpentier, la madre de Chano, formuló un dramático llamado para modificar el artículo dela Ley Nacional deSalud Mental que impide que un adicto pueda ser internado contra su voluntad. “No quiero estaren el velorio de mi hijo”, dijo.r.33  HAY VENTAS EN VIVO  El Hot Sale 2022 arrancó con un descuento promedio de 26%  La edición de este año, que empezó ayer, viene con algunas novedades. Doce empresas participantes mostrarán sus productos a los usuarios en una transmisión de alta calidad, en vivo, y los clientes podrán consultar con un chat. “Live shopping” es el nombre de la modalidad y en los dife rentes horarios el streaming será conducido por Julián Weich. Por otra parte, en el primer día de ventas general, los descuentos de los diferentes productos del total de 1.091 marcas que se ofrecen, promediaron el 26%. Pero en el rubro Servicios la rebaja llegó al 69%. p.30  CUMBRE DE LAS AMÉRICAS  Inquietud en Washington por lasidas y vueltas de Fernández  El Presidente aún no decidió si irá a la reunión en Los Angeles. Fernández había lanzado una contracumbre, en protesta por la no inclusión de Cuba, Venezuela y Nicaragua. Antela negativa de México, la idea no prosperó. Analistas en EE.UU. no ven cómo puede convenirle ala Argentina la defensa de esos países. p.11  SUBE EL CONSUMO  Porlaimportación cae el costo dela carne porcina, pero daña la producciónlocal  Como China dejó de comprar carne de cerdo, hay excedente en todo el mundo y el producto se abarató. Argentina aumentó la importación y hoy cuesta casi la mitad que la carne vacuna. Esto perjudica alos productores locales, que no pueden competir con esos precios. P.18  INVESTIGAN SI HUBO EXCESOS  Berni defendió alos policías que balearon al chico del country  Para el ministro de Seguridad se hizo todo bien. La familia de Tomás Krúger dice que no para de llorar y está aterrado. Tienen que volver a operarlo. p.28  Gonzalo Abascal  ¿Primero la gente o primero la interna?  Pz  REPUBLICA ARGENTINA, AÑO LXXVIN' 27.476 RECARGO ENVIO AL INTERIOR: $ 30,00 PRECIO DE LOS OPCIONALES, EN EL ÍNDICE DE LA PÁGINA 54, 
;20220601.jpg;Problemas para la producción agrícola  Ya falta gasoil en ocho provincias a pesar de la promesa del Gobierno  Transportistas y productores del norte  del país vienen denunciando desde ha ce semanas el faltante de gasoil en varias provincias. El gobernador de Tucumán intervino para frenar un paro de camioneros en su provincia por ese  motivo, pero la cámara que agrupaa las empresas de transporte dijo que hay otras siete provincias -Misiones, Formosa, Corrientes, Jujuy, Salta, Santa Fe y Entre Ríoscon un alerta rojoen las estaciones de servicio. Los goberna Un toque de atención para la solución argentina de los problemas argentinos  BUENOS AIRES, ARGENTINA PRECIO: $180,00  dores hablaron varias veces sobre la cuestión con el Gobierno y la semana pasada el jefe de Gabinete, Juan Manzur, dijo que se ocuparía del problema. El gasoil es un insumo irremplazable para la producción. p6  ganaron su pr  encuentro por eo de Leyendas. A los52, Sabatini se mostró impecable. p.43  Otra hazaña de Nadal: eliminó a  Djokovic y va por su 14” título  LA PELEA POLÍTICA  Fernández otra vezle pegóa Macri, que le contestó: “Está fuera de quicio”  Acorralado por los problemas de su administración, el Presidente buscó correrse de la tormenta y dijo queen el gobierno de Juntos por el Cambio hubo “ladrones de guante blanco” que impedían que se concluyeran las obras públicas. Le respondió Macri con dureza y atrás del ex presidente salieron otros dirigentes opositores. Pp  Ahora sí, a la Cumbre  Después de idas y vueltas, el Presidente irá al encuentro convocado por EE.UU. en Los Angeles  SE UNIFICARON INICIATIVAS La oposición logró aprobar en Diputados el proyecto de Boleta Unica  Juntos por el Cambio consiguió acercar posiciones con otros bloques y consiguió imponer el dictamen de comisión de un proyecto que instala la Boleta Única para las elecciones. Están cerca de votarlo en el recinto. El Frente de Todos buscará trabarlo en el Senado. p12  ULTIMÁTUM DEL KREMLIN  Putin: “El 1” dejulio  el Este de Ucrania debe serruso”  El presidente de Rusia dio esa ordena su ejército luego de que la Unión Europea aprobara un histórico embargo al petróleo del Kremlin. Se trata de la zona del Donbas, con una fuerte presencia de rusoparlantes y afines a Moscú entre su población. Las tropas  ya se concentran en Severodonetsk, donde los combates son cada vez más intensos. Pese a la feroz resistencia de los ucranianos, los rusos lograron apoderarse del 70% de la ciudad, que es clave para controlar la región oriental del país. p.20  DelEditor  Ricardo Roa  Ancelotti: una historia queesun mensaje y un espejo donde mirarse  14  REPUBLICA ARGENTINA, AÑO LXXVIN' 27.477 RECARGO ENVIO AL INTERIOR: $ 40,00 PRECIO DE LOS OPCIONALES, EN EL ÍNDICE DE LA PÁGINA 54, 
;20220602.jpg;La relación con Estados Unidos  Fernández habló con Biden: irá a la Cumbre y se verán a solas en julio  El Presidente habló 25 minutos con su colega estadounidense. Fernández se comprometió a participar de la Cumbre de las Américas que se hará la semana que viene en Los Ángeles y con siguió un encuentro a solas con Biden. Esa cita ocurrirá recién el 25 de julio en la Casa Blanca y es un encuentro que Fernández venía pidiendo desde hace meses. La relación con Washington tu Un toque de atención para la solución argentina de los problemas argentinos  BUENOS AIRES, ARGENTINA PRECIO: $180,00  vo varios puntos de tensión desde el inicio de la gestión del presidente argentino, que se agravaron por el acercamiento a Rusia en los días previos al inicio dela invasión a Ucrania. P.12  MEJORA EN LAS EXPORTACIONES  Campo: entran 4.231 millones de dólares, pero al Central no le queda casi nada  En mayo ingresó esa cifra porlasexportaciones. Esun 33% másalta que la que había aportado el sectoren el mismo mes del año pasado, y esel récord histórico. El problema para el Gobierno esqueel Banco Central sólo retuvo US$790 millones de ese monto, según el balance del mes pasado.r.3  Símbolo. Messi, capitán y nuevamente figura.  vr  Dl aki ' » Á  744 Mm  LA SELECCIÓN SIGUE DE RACHA: 3-0 A ITALIA EN WEMBLEY  Invictos y más confiados que nunca  El equipo de Scaloni extendió su racha invicta a32 partidos y venció en el desafío intercontinental al campeón europeo. Italia, que sorpresivamente no pudo clasificar para el Mundial, decayó en  el segundo tiempo y allí aparecieron los lujos de Messi y cía. Lautaro Martínez y Di María (dos de las grandes figuTas) marcaron los primeros goles y, cuando se cerraba el partido, completó  MARIO QUINTEROS  Dybala, quien acababa de ingresar. Argentina, desde la conquista dela Copa América, seviene afianzando como equipo y aspira a llegar como uno de los candidatos en Qatar.P.42  CIUDAD  La pandemia golpeó fuerte el aprendizaje de Lengua en la secundaria  Más de la mitad no pasa el nivel básico o no contestó la prueba. En el nivel avanzado, casi 2 de cada 10 estudiantes no pudo responder nada. Surge de evaluaciones tomadas en 2021, respecto de 2019, en escuelas públicas y privadas. Calculan que se necesitarán 3 años para recuperarel nivel perdido. p.34  Escuelas sin gas  El ministro Sileoni admitió el problema que redujo horarios o dejó sin clases a decenas en Provincia.  Pablo Vaca  El Presidente, los guantes blancos y los manchados  14  REPUBLICA ARGENTINA, AÑO LXXVIN' 27.478 PRECIO EN C.A.B.A, Y GBA CON ZONAL: $ 195,00 RECARGO ENVIO AL INTERIOR: $ 40,00 PRECIO DE LOS OPCIONALES, EN EL ÍNDICE DE LA PÁGINA 58, 
;20220603.jpg;Sin el apoyo de 4 provincias clave, el Gobierno intenta licuar el poder de la Corte  El Presidente juntó a 13 gobernadores para presentar un proyecto que propone una Corte Suprema de 25 miembros, con representantes de las provin cias. En el acto no estuvieron los mandatarios de Córdoba, Santa Fe, la Capital Federal y Mendoza, cuatro de los cinco distritos más poblados. Sí estuvo  Un toque de atención para la solución argentina de los problemas argentinos  BUENOS AIRES, ARGENTINA PRECIO: $180,00  Axel Kicillof. Es un plan que siempre impulsó el kirchnerismo. Hoy, tras más de 90 días sin diálogo, vuelven a verse Alberto Fernández y la vice. P.3  Siete décadas del reinado de Isabel  REUTERS  Heredero. El príncipe Louis, hijo i de los duques de Cambridge, figura en la lista de sucesión.  El “Jubileo de Platino” que celebra el reinado más largo de la historia en la Corona británica-se extiende hasta el domingo en parques y avenidas de Londres. Isabel II saludójunto a sus herederos desde los balcones de Buckingham. p.30  NUEVA ETAPA  Anuncian una suba del boleto de colectivo del 40% en Ciudad y el Conurbano  Lo adelantó el jefe de Gabinete, Juan Manzur, y luego lo confirmó la Secretaría de Transporte de la Nación. El boleto mínimo pasaría de$18a$25,20, para intentar reducirlos subsidios. En Córdoba, Rosario y Santa Fe, el pasaje más bajo ya se paga $ 69,50. p.39  EMPLEO PÚBLICO  La AFIP, el PAMI yla TV Pública, enla lista delos sueldos más altos  Los empleados públicos que más ganan son los de Nucleoeléctrica Argentina, con un promedio de $746.920 mensuales en bruto. En AFIP, el salario es de $ 559.807, en el PAMI, $ 428.618 y en la TV Pública$ 367.933. El sueldo privado promedio es de $122.583. p.22  JUNTOS POR EL CAMBIO  Unreferente del PRO dijo que Macri merece “un segundo tiempo”  Es Néstor Grindetti, intendente de Lanús. El año pasado fue el jefe de campaña del larretista Diego Santilli. p.14  CONMOCION EN EL NORTE  Un funcionario de Jujuy baleó asu esposa y se suicidó  Era el secretario del Tribunal Electoral de la provincia, Horacio Pasini Bonfanti. Intentó asesinar a su mujer -quien quedó internada en el hospital Soria, aunque fuera de peligroy después se pegó un tiro. El drama familiar ocurrió en el municipio de Yala, a pocos kilómetros de la capital jujeña,  en una zona conocida por su atractivo turístico y gastronómico. La mujer herida es fonoaudióloga e hija de un destacado político de la provincia. Tiene dos hijos del matrimonio con Pasini y ahora el caso es investigado por la Fiscalía Especializada en Violencia de Género. p.34  Ignacio Miri  Alberto-Cristina: una foto que no tapa las diferencias  Pz  REPUBLICA ARGENTINA, AÑO LXXVIN' 27.479 RECARGO ENVIO AL INTERIOR: $ 40,00 PRECIO DE LOS OPCIONALES, EN EL ÍNDICE DE LA PÁGINA 58, 
;20220604.jpg;Roland Garros  Peleaba punto a  Nadal, sufrió una  en el tobillo y abandonó El español irá por su inct 14” título en Roland Gal  — Y  sE y Pignatidlo A  Retirarse a los 22  P.54  Clínicas clausuradas  Denuncias por dos cirugías estéticas  —] ro  El juego del poder Borgen regresa —— con sus intrigas  SPOT  REUTERS  Gestos. Cristina Kirchner dio un discurso largo, apoyada por videos y cartulinas. Alberto Fernández habló poco y no le contestó.  Fernández compartió con la vice el primer acto en más de tres meses  Cristina no para: “Te pido queusesla lapicera, Alberto”, le dijo en el acto de YPF  El Gobierno celebró en Tecnópolis los 100 años de la petrolera y la reunión sirvió como reencuentro para Alberto Fernández y Cristina Kirchner, que no se veían desde el 1” de marzo por la escalada de su pelea interna. Hubo algún gesto de distensión entre ellos, pero la  vicepresidente -que habló media hora más que el Presidentecriticó a Techint, la empresa que fabrica los caños del gasoducto de Vaca Muerta, la obra más celebrada por Fernández en las últimas semanas. “Te dije que vos tenías la lapicera”, le cuestionó. p.4  Interminables idas y vueltas por el gasoducto »z  CAMBIO EN UN ÁREA CLAVE  Agustín Rossi, un kirchnerista hoy cercano al Presidente, será el jefe dela AFI  Elex ministro de Defensa reemplazará a Cristina Caamaño, la actual interventora de la Agencia Federal de Inteligencia, que era muy criticada en la Casa Rosada. La modificación circulaba como rumor desde hace meses y ayer fue confirmada por voceros del Gobierno. P.6  CORRUPCIÓN Y OBRA PÚBLICA  Causa Vialidad: el fiscal acusaráa la vice en julio y la sentencia llegará antes de fin de año  Eseljuicio másimportante que enfrenta en este momento Cristina Kirchner. Se investiga el direccionamiento de contratos a favor de Lázaro Báez por US$ 3.500 millones. La vicepresidente está procesada como jefa de una asociación ilícita. p.14  Héctor Gambini  El plan de la Corte títere, ola trampa de la suma que resta  P.3  REPUBLICA ARGENTINA, AÑO LXXV N" 27480 RECARGO ENVIO AL INTERIOR: $ 40,00 PRECIO DE LOS OPCIONALES, EN EL ÍNDICE DE LA PÁGINA 58, 
;20220605.jpg;Racing Un debut que se le simplificó  En el comienzo del  Infidelidad ruptura confirmáQg  Crisis en el Gobierno  Cristina logró echar a otro ministro de Fernández: lo reemplaza Scioli  Daniel Scioli dejará la Embajada en  Brasilia para asumir como nuevo ministro de Producción tras la salida de Matías Kulfas de ese cargo. Kulfas se  por funcionarios que responden a ella. También insinuó que esa licitación fue hecha a medida de una empresa. Cristina consideró “penosa” la actitud de  había enfrentado a Cristina Kirchner Kulfas y el Presidente echó asía uno de Llega un candidato al al decir que la licitación para el gasosus ministros más cercanos. Elembaj Ps Á  ducto Néstor Kirchner, que la vice hajador en Brasil sonaba desde hace Gabinete: ¿que Vaa bía criticado el viernes, fue organizada tiempo para integrarse al Gabinete. p8 hacer el Presidente?  DelEditor  do Roa  Celebrar la reconciliación con el despido de Kulfas  IGNACIO BLANCO/LOS ANDES  Lafalta de gasoil ya complicaa 18 provincias  La situación es crítica en el Norte y el problema se extiende al Centro y Oeste. Afecta la cosecha y la logístca del transporteen economías regionales. Y se suma la demanda extra de los extranjeros en ciudades de frontera. Las estaciones fijan cupos. p.14  SOSPECHAS DE CORRUPCION  Mayra Mendoza y SU ex esposo aparecen en una de las empresas investigadas  Aunquela intendenta de Quilmes dice que “nunca funcionó”, está constituida por ella, su ex y funcionarios. La Justicia investiga la relación con la red de cooperativas que recibió $535 millones. P.18  IMPACTO EN LAS RESERVAS  Pasajes y tarjetas: se cuadruplicó el gasto en dólares en un año  El atraso del tipo de cambio aceleró esos consumos. Alertas por la gran cantidad de argentinos en Wembley y el impuesto PAIS. p.24  REPÚBLICA ARGENTINA, AÑO LXXVI, N'27.481RECARGO ENVÍO AL INTERIOR: $ 40,00 PRECIOS DE LOS OPCIONALES, EN EL ÍNDICE DE LA PÁGINA 70. 
