;20211128.jpg;Almudenc  El adiós al: escritora espa Murió a los |  Se fue aclamada por sus novelas.  P.52  Nacida en Madri deja una obra muy respetada,  la,'  Por la pandemia Celebrar la fiesta 5, pero a los 16  La vicepresidenta admitió la derrota y que no tendrá mayoría propia en el Senado  Cristina se despega de un acuerdo con el FMI: el que decide es el Presidente  La vicepresidenta volvió a condicionaral Gobierno con una carta pública. Tras criticar a la oposición y a la prensa por la deuda con el FMI, advirtió sobre los riesgos de un acuerdo. “Puede constituir el más auténtico cepo del que se tenga memoria”, dijo. Y trasladó  la responsabilidad al Congreso y aAlberto. “La lapicera no la tiene Cristina, siempre la tendrá el Presidente”, afir mó. Dirigentes de la oposición reaccionaron con dureza y, desde la Casa Rosada, recibieron la carta como un respaldo a Alberto Fernández. 8  K Guzmán, un blanco móvil con plazo para su continuidad  um  Veinte años. Carrió, en el escenario. La miran Larreta, Macri y Bullrich.  PRENSA CC  Elogios, críticas y mariachis en la fiesta de Lilita  Carrió celebró los 20 años de su partido, la Coalición Cívica, con un evento en Open Door. Fueron Larreta, Macri, Bullrich, Vidal, Santilli y Negri. Hubo pocos radicales. Matizó elogios y críticas en su discurso y un grupo de mariachis cantó al final. p.18  CAUSA DE LOS CUADERNOS  Enunaudio, amenazanrevelar las coimas que Jaime habría pedido para Kirchner  Es otra de las revelaciones que aparecen en el celular del ex colaborador de Julio De Vido, Roberto Baratta. En 2017 el abogado de Ricardo Jaime, ex secretario de Transporte K, le pedía dinero a Cristina para no revelar supuestos sobornos que reclamaba a empresarios para Néstor Kirchner. px4  COVID EN EL MUNDO  La cepa que viene de Africa alarma aEuropa, eIsrael anuncia el cierre de sus fronteras  Ala suba de contagios en Europa, se suma el alerta por la cepa Ómicron, que llega desde el sur de África. Un avión llegado a Amsterdam registró 61 casos, y hay más en Reino Unido, Alemania e Italia. Israel, que tiene un caso y varios sospechosos, cerró sus fronteras a todos los extranjeros durante dos semanas. p.34  JOSE C. PAZ  Detienena un policía dela Ciudad: matóaun hombre quelo atacó  El oficial iba en un auto con una joven embarazada. P.58  REPUBLICA ARGENTINA, AÑO LXXVIN' 27.296 RECARGO ENVIO AL INTERIOR: $ 25,00 PRECIO DE LOS OPCIONALES, EN EL ÍNDICE DE LA PÁGINA 74, 
;20211129.jpg;ClarínX  Guillermo Roux Adiós al maestro  Versátil como pocos, deja un enorme legado en el arte argentino. Murió de leucemia, alos 92 años. pas  Un toque de atención para la solución argentina de los problemas argentinos  Lunes 29.11.2021  BUENOS AIRES, ARGENTINA PRECIO: $130.00  Messi, favorito para ganar ' suséptimo Balón de Oro  PA premio se entrega hoy y reedita el duelo con Cristiano. oe.  Tema del día + Una negociación trabada en medio de una fuerte pérdida de reservas  El Gobierno apura su propuesta al FMI no pagaría hasta 2024  Preocupado por la desconfianza de los mercados, el derrumbe de los bonos y la caída de reservas, intenta lograr algún entendimiento en diciembre, en paralelo al pago de US$ 1.880 millones. La pretensión es no pagar más hasta 2024 y, al mismo tiempo, que le reintegren parte de los  Pagos efectuados este año con los Derechos Especiales de Giro que adelantó el mismo Fondo. En 2022 y 2023 vencen en total US$ 38.400 millones. Una iniciativa que los economistas descartan por fantasiosa es buscar ayuda financiera en países como Rusia y China. P.3  Unrío en plena General Paz  Lasintensas lluvias se convirtieron en protagonistas de la jornada. En apenas una hora cayeron 30 milímetros, inundando barrios de la Ciudad y el GBA. Hubo alerta amarilla y hasta se suspendió el partido de la noche entre Boca y Newell's. p34  La oposición exige un plan Reclaman conocer  si contará con el  apoyo de Cristina, después de su carta  Circulación alterada. A la  altura del cruce con Beiró, por tormentas breves pero intensas.  VIAJES AL EXTERIOR  Aerolíneas y agencias analizan presentarseante la Justicia por el fin delas cuotas  Hoy sereúnen las cámaras de las líneasaéreas y la federación de empresas de viajes y turismo. Analizarán una presentación judicial colectiva a raíz de la prohibición del Banco Central de vender pasajes y paquetes al exterior financiados con tarjetas. El 60% delos viajeros compra con algún tipo de cuotas. P18  CORONAVIRUS  Israel cierra sus fronteras y la nueva cepase detecta en cada vez más países  Israel es el primero en tomar esa decisión ante el avance de la variante ómicron. En Italia detectaron el primercaso, pero con síntomas leves. También llegó a Australia, Países Bajos y Alemania entre otros. Analizan más restricciones. 32  INGENIERO BUDGE Motochorros balean auna mujer policía que defendió asu padre de unrobo  Melissa Duarte, de 22 años, fue herida en el pecho. Logró sobrevivir. p30  DETUVIERON A LA MADRE Y SU PAREJA  Conmociónen  La Pampa por el crimen de Lucio, elnene queno debió morir  Lucio Dupuy tenía 5 años. En la madrugada del sábado, su madre, Magdalena Valenti, lo llevó a una sede policial dondele practicaron RCP y lotrasladaron aun hospital. Allí murió. Tenía golpes, mordeduras y quemaduras. El nenevivía con su madre y la pareja deés ta, Abigail Páez, que obtuvieron la cus todia en 2020. El papá, Christian Dupuy y su familia, reclamaban porque no les permitían verlo. “La Justicia nunca me escuchó, dijo. Ayer hubo marchaseincidentes frente a la comisaría donde las mujeres están detenidas. P.28  Dela Editora  Silvia Fesquet  El Gobierno, entre laimprovisación y los papelones  14  REPUBLICA ARGENTINA, AÑO LXXVIN' 27.297 RECARGO ENVIO AL INTERIOR: $ 25,00 PRECIO DE LOS OPCIONALES, EN EL ÍNDICE DE LA PÁGINA 46, 
;20211130.jpg;Un toque de atención para la solución argentina de los problemas argentinos  BUENOS AIRES, ARGENTINA PRECIO: $130,00  Tema del día e Agencias y aerolíneas por ahora no van a la Justicia  Por el cepo alas cuotas, los pasajes de cabotaje subieron hasta un100%  Desde el jueves, cuando se anunció el fin dela venta de pasajes al exterioren cuotas, el precio para volar dentro del país se disparó con subas que llegan hasta un 100%. Este aumento seregistra en lasaeTolíneas privadas y también en Aerolí neas Argentinas: un pasaje a Ushuaia, que hace una semana costaba $ 49.658,  ayerestabaen $99.740. Los tickets aéreos  ya tenían valores altos por la mayor demanda porel Previaje y por la menor cantidad de vuelos por el Covid.p3  Cruce entre voceros Aníbal Fernández dijo que el Gobierno revisaría la medida, pero Gabriela Cerruti lo negó.  El Balón de Oro que llega dela mano dela Selección  Por séptima vez Messi se quedó con el premio al Mejor Jugador del Año, y sumó otro récord. Pero este año la distinción tiene otro sabor: fue impulsada por su actuación en la Copa América.  permitió di: mo nunca antes. P.32  Alegría indisimulable. El triunfo de este año con la Selección hizo que el festejo fuera completo.  POLÍTICA CAMBIARIA  El Central dice que el límite a los bancos no afecta depósitos en dólares  La semana pasada ordenó a los bancos ajustar su nivel de dólares y vender el excedente. Eso disparó una noticia falsa que generó inquietud entre los ahorristas. El Central debió salir a aclarar que la medida no tiene ningún efecto sobre los depósitos en dólares de la gente. Según expertos, los bancos tienen una liquidez alta en pesos y en dólares. P6  Bonos, en caída libre  En los últimos seis días perdieron 6,2%. La carta de Cristina no sirvió.  NUEVA CEPA DEL COVID  Másidas y vueltas por el pase sanitario: Vizzotti desmientea Kreplak  El ministro de Salud de Provincia habló de que sería para lugares de trabajo, escuelas o transportes. Pero la ministra de Nación lo desmintió y dijo que el pase sanitario está en estudio y que sería para eventos masivos. Lo único concreto es que será para mayores de 13 años. p.29  ASESINADO A LOS 5 AÑOS  Los pedidos de ayuda de Lucio que nadie oyó  “Sacale la ropa y cagalo a palos, dejalo marcado porque lo mato yo”. Ese es el grito que escuchó una vecina del de partamento donde Lucio Dupuy, asesinado el viernes, vivía con su madre y la pareja de ésta. La policía se equi vocó de casa eignoró el pedido. Hubo  una sucesión de omisiones y reclamos: desde el hospital donde ingresó varias veces este año hasta la Justicia que, según denuncia la familia paterna, no los escuchó y le dio la tenencia ala madre. Investigarán la posible negligencia del Estado. p.26  La nueva normalidad: altainflación y mega cepo  14  REPUBLICA ARGENTINA, AÑO LXXVIN' 27.298 RECARGO ENVIO AL INTERIOR: $ 25,00 PRECIO DE LOS OPCIONALES, EN EL ÍNDICE DE LA PÁGINA 50. 
;20211201.jpg;ClarínX  Un toque de atención para la solución argentina de los problemas argentinos  BUENOS AIRES, ARGENTINA PRECIO: $ 130,00  Tema del día + Nuevo récord del riesgo país, que llegó a 1.905 puntos  Sigue la desconfianza: otra vez  cayeronlos bonos y el Central debió vender US$ 135 millones  El riesgo país no encuentra techo y por 11 día consecutivo ayer subió al nuevo récord del año, con 1.905 puntos bási cos para cerrar en 1.898. Las dudas que persisten en torno a un acuerdo con el  FMI siguen empujando los bonos a la baja: ayer cayeron 2,6%. El Banco Central cerró noviembre con más turbulencias de las esperadas y en el mes debió vender US$ 890 millones para fre nar al dólar. Esto ocurre después del cepo ala financiación en la compra de pasajes al exterior con tarjeta, y de ordenara los bancos que ajusten su stock de dólares propios. P.3  ROCES EN JUNTOS POR EL CAMBIO  En un intento por frenar la tensión interna, Larreta sejuntó con Macri y con Carrió  Después de las críticas de Carrió por su relación con Sergio Massa, fue hasta Exaltación de la Cruz para limar asperezas con ella. Horas más tarde visitó en Vicente López a Mauricio Macri, con quien disputa el liderazgo del espacio. pa  l)  a]  = — == = = =  Un altar improvisado. Frente a la Fiscalía de Santa Rosa, ruegos y recordatorios: "No me olviden” y "No siempre la buena es mamá".  REVELACIONES DE LA AUTOPSIA  Una historia atroz detrás del crimen de Lucio  El resultado de la autopsia de Lucio Dupuy, el nene de 5años asesinado el viernes, por cuya muerte están detenidas su mamá y la pareja de ésta, reveló más horrores a los ya conocidos. A los golpes, mordeduras y quemaduras de tectados, se suma ahora que el nene fue víctima de abusos sexuales “recientes y de vieja data”. “En mis casi 30 años de profesión nunca vi algo asf”, dijo el forense. La Fiscalía de Investigaciones Administrativas solicitó al  Ministerio de Salud un informe sobre los reiterados ingresos de Lucio a distintos hospitales: fueron cinco veces en tres meses, por presentar lesiones de gravedad como fracturas y traumatismos. Nadie los denunció. 29  COSTO DE VIDA  Feletti admite quela inflación siguió muy alta ennoviembre  El secretario de Comercio reconoció el impacto limitado del congelamiento de precios en el costo de vida: cree que se mantendrá en el nivel de octubre, que fue de 3,5%. Buscará nuevos acuerdos con los sectores de alimentos frescos, como pollo, carne, pan y lácteos. P.5  EVALUACIÓN DE LA UNESCO.  Alumnosargentinos, por debajo del promedio enla región  La prueba compara los aprendizajesen Matemáticas, Lectura y Cienciasen chicos de3” y 6” grado. En  13 años el país pasó de estar porencima del promedio regional a ubicarse por debajo. p.26  DelEditor  Ricardo Roa  Menos mal quelotenemos aMessi  P.2  REPUBLICA ARGENTINA, AÑO LXXVIN' 27.299 RECARGO ENVIO AL INTERIOR: $ 30,00 PRECIO DE LOS OPCIONALES, EN EL ÍNDICE DE LA PÁGINA 54. 
;20211202.jpg;ClarínX  y] ar Pe  Tema del día + Una causa vinculada al hundimiento del ARA San Juan  Un toque de atención para la solución argentina de los problemas argentinos  BUENOS AIRES, ARGENTINA PRECIO: $ 130,00  Procesan a Macri por presunto espionaje y le prohíben salir del país  Eljuez subrogante de Dolores, Martín Bava, procesó al ex presidente, le trabó embargo por $ 100 millones y le prohi bió la salida del país. Macri se enteró en  Chile, de donde regresó ayer y apelará.  La oposición criticó la medida. Bava ar gumentó que el ex presidente “generó las condiciones” para que se espíe alos familiares de las víctimas del ARA San  Juan. Se basó en un informe de la comi sión de inteligencia que preside el diputado ultra K Leopoldo Moreau. p.3  “Persecución política” El ex presidente  criticó con dureza al juez que lo procesó.  Alec Baldwin: ”Yo no disparé”  En su primera entrevista desde la tragedia en la filmación de “Rust” -cuando un disparo mató a la directora de fotografía, Halyna Hutchinsel popular actor estadounidense afirmó que él no apretó el gatillo. “Nunca lo haría”, insistió. p.52  CAPTURA DE VIDEO  Entre lágrimas. Alec Baldwin, entrevistado por la cadena ABC.  CONFLICTO CON EL CAMPO  El Gobierno le avisó ala Mesa de Enlace que el cepo ala carne seguirá en 2022  El Ministerio de Agricultura les anticipó alos dirigentes del campo que los embarques de carne se reducirán de 800 mil toneladas exportadas este año a 600 mil el próximo. Los productores propondrán queel cepo rija sólo para cortes populares de asado y milanesa. p.23  CAUSAS LOS SAUCES Y HOTESUR  Revés para Cristina: cambió la integración de un tribunal federal clave  Eljuez Fernando Canero salió sorteado para integrar el Tribunal Oral Federal 5, que acaba de sobreseera la vicepresidenta en estas causas. Reemplazará al magistradoK, Adrián Grúnberg. Y, si Casación reabre el caso, Cristina podría volver a ser procesada. P.8  DICIEMBRE SIN CONFLICTOS Les dan $ 100 mil millones extra a los piqueteros  El Gobierno lo dispuso para movimientos sociales y La Cámpora. p.12  LA CAÍDA ANTE EL CLUB DE TAPIA  Villa Dálmine  echó a 16jugadores  por una derrota bajo sospecha  Fue después de la polémica caída ante Barracas Central, el club que preside Matías Tapia, hijo del titular de la AFA. El partido, jugado hace tres semanas, era por la Primera Nacional y el plantel de Dálmine quedó envuelto en las sospechas. Siete de losjugadores desvinculados fueron titulares en  ese partido y otros tres, ingresaron en el segundo tiempo. El DT de Dálmine, Marcelo Franchini, ya había licenciadoal plantel por un fuerte malestar interno, aunque dijo: “Sigo creyendo en la honestidad de misjugadores”. El Plantel, que recibió amenazas, negó acusaciones de soborno. p.44  DelEditor  Héctor Gambini  Un tour de seis días por el país de locos  P.2  REPUBLICA ARGENTINA, AÑO LXXVIN' 27.300 PRECIO EN LA C.A.B.A. Y GBA CON ZONAL: $ 140,00 RECARGO ENVIO AL INTERIOR: $ 30,00 PRECIO DE LOS OPCIONALES, EN EL ÍNDICE DE LA PÁGINA 58. 
;20211203.jpg;Tema del día + Otra interna en el Gobierno  Peleada con susjefes, se fue la 2 de Comercio ados meses de asumir  Débora Giorgi operaba como la segunda del secretario de Comercio, Roberto Feletti. Habían asumido hace menos de dos mesesimpulsados por Cristina Kirchner, en reemplazo de la camporista Paula Español. Su plan  era endurecer los controles de precios para contener la inflación, un objetivo que no lograron concretar. Ayer, Gior gi se fue de la secretaría. El Presidente nunca había firmado el decreto con su nombramiento. P.3  Un toque de atención para la solución argentina de los problemas argentinos  BUENOS AIRES, ARGENTINA PRECIO: $ 130,00  Alberto no usó la lapicera y Débora setuvo queir»z  _—  Merkel se despide en medio del rebrote de la pandemia  ua  Despedida. Merkel deja el cargo en una semana. Un homenaje con desfile, rosas rojas y música de Nina Hagen.  Ante la nueva ola de Covid y la llegada de la variante ómicron, el gobierno alemán de la canciller Angela Merkel -quien termina su mandatodecidió que los no vacunados no podrán entrar a comercios, restaurantes y lugares de ocio. p.32  LEGISLATURA  Aprueban la construcción de torres junto al río  El proyecto para construir edificios de hasta 8 pisos en Costa Salguero establece que se podrá usar el 22,5% de la superficie del predio, mientras que deberán destinar el resto a espacios públicos, estacionamientos para bicis  y gastronomía. También se aprobó la rezonificación para la construcción en altura en la ex Ciudad Deportiva de Boca. Se trata del predio privado más grande de la Ciudad. Fuertes críticas de los bloques opositores. p.40  BUSCAN BURLAR UNA LEY  Yason16los intendentes que pidieron licencia para poder serreelectos  Se fueron antes del 10 de diciembre para no cumplir dos años en su segundo mandato. Así, buscan evitar la ley bonaerense que impide enCadenar tres gestiones seguidas. Ayer, pidieron licencia Jorge Macri (Vicente López) y Ariel Sujarchuk (Escobar). p.8  LA CRISIS DE LAS RESERVAS  En dos días  los ahorristas retiraron de los bancos US$ 400 millones  Fue entre el lunes y el martes, luegode conocerse una medida del Banco Central la semana pasada queobligó alos bancos a vender sus propios dólares y provocó incertidumbre. Pese a las aclaraciones de la autoridad monetaria, el nerviosismo se mantuvo. P.30  ersonaje  ADRIANO CARIO  Escándalo en el Parlamento  El senador en Italia fue expulsado por falsificar votos desde la Argentina en la elección del 2018. e. 35  NA sl  REPUBLICA ARGENTINA, AÑO LXXVIN' 27.301 RECARGO ENVIO AL INTERIOR: $ 30,00 PRECIO DE LOS OPCIONALES, EN EL ÍNDICE DE LA PÁGINA 70, 
;20211204.jpg;Agustina Caride El bordado de la grieta  en una casa en ]Ingeniero Budge'h  P.42  Marchas. Familiares y allegados a Nancy con reclamos de justicia.  Tensa definición Verstappen-Hamilton, por la corona de F-1  P.56  Definiciones de Kristalina Georgieva  El Fondo advierte que “todavía hay mucho por hacer” para un acuerdo  Apocas horas de que una misión argentina arranque a negociar en Washington, la número 1 del FMI lanzó una dura advertencia sobre el estado delas negociaciones. “Todavía hay mu cho por hacer”. Martín Guzmán había dicho que buscaba un acuerdo para antes de fin de año. Pero ahora los tiempos podrían demorarse y el programa estaría recién para 2022. p.4  Fondos de inversión  En Wall Street hay preocupación por la economía  CRISIS CAMBIARIA  Mala semana para el Central: debió vender casi US$ 400 millones  Luego de la comunicación de la autoridad monetaria que obligaba a los bancos a vender sus dólares, el mercado reaccionó en la semana demandando más billetes. El viernesel BCRA vendió US$ 140 millones y se fueron casi US$ 400 millonesentre lunes y viernes. P.10  Desolado. El foro  era para difundir la problemática de los grupos vulnerables.  nl A La de  PS  Donda viajó a Suiza para hablar en u auditorio vacío  Apenas diez personas siguieron la disertación de la titular del INADI, quien estuvo en Ginebra para presidir un foro de las Naciones Unidas sobre minorías. Tuvo dificultades al hablar en inglés y fue criticada en fuentes diplomáticas. p.18  COMPENSACIONES  Ahora dicen en el Gobierno que se pagaría un bono de fin de año a jubilados  La vocera presidencial lo había descartado, mientras confirmaba el pago de $ 8.000 extra el 20 de este mesa los beneficiarios del Plan Potenciar Trabajo. Pero la titular de la ANSE€S, Fernanda Raverta, dijo que “se está evaluando” un bono para losjubilados y para quienes reciben la AUH.p.27  El fallo qu ahora teme el Gobierno  P.3  REPUBLICA ARGENTINA, AÑO LXXVIN' 27.302 RECARGO ENVIO AL INTERIOR: $ 30,00 PRECIO DE LOS OPCIONALES, EN EL ÍNDICE DE LA PÁGINA 66, 
;20211205.jpg;Boca  Sin rumbo y muchas dud  Sólo empató 1con Arsenal y  La negociación por la deuda con el organismo internacional  El FMI objetó la primera propuesta que acercó Guzmán para el acuerdo  Mañana en Washington la delegación argentina y funcionarios del staff del Fondo Monetario empiezan a negociar un sendero para reducir el déficit fiscal y la emisión monetaria. Hay  cuestionamientos a la meta de inflación que presentó el ministro. Guzmán proyecta que los precios subirán 33%, pero el mercado apunta al 52,1%. El FMI exigirá acciones concretas. P.26  Del Editor  Animémonos y vayan: Cristina ante el FMI  CONFLICTO EN LA PROVINCIA  El peronismo impulsa una ley para darles otra reelección a losintendentes  El diputado kirchnerista Walter Abarca ingresó un proyecto en la Legislatura bonaerense. Pide cambiar la fecha de la suspensión de la reelección indefinida que acordaron Vidal y Massa en 2016. Y tomar co'mo primer mandato el 2019. Así, podrían ser reelegidos en el 2023.p.8  _——___  UBAZ00/PABLO AHARONIAN  Todas las voces. Los ídolos, ante una multitud anoche en Recoleta.  Los 200. años osde la UBA, un festejo a pura canción  La universidad pública cerró la celebración de su bicentenario con un recital al  aire libre en la Facultad de Derecho. Actua ron Lebón, Baglietto, Soledad, Elena Roger, Lavié, Vitale, Jairo y Abel Pintos, entre las figuras. Y cerraron con el Himno. p.48  RIESGOS DE COVID  Detectan un caso dela cepa ómicron en el Sur de Brasil, cerca dela frontera con Argentina  Las autoridades de Salud de Brasil detectaron un caso de la cepa africana en Rio Grande do Sul, cerca dela frontera con Argentina. Ya hubo casosen San Pablo y Río de Janeiro. En diálogo con Clarín, el infectólogo Eduardo López admitió que “es muy claro el riesgo de un rebrote” en nuestro país. P. 46  COMICIOS POLITIZADOS Moyano impugnó  la lista de Doman  en Independiente  El camionero va por su reelección y  busca evitar competir con el periodista, avalado por la oposición. P.66  REPUBLICA ARGENTINA, AÑO LXXVIN' 27.303 RECARGO ENVIO AL INTERIOR: $ 30,00 PRECIO DE LOS OPCIONALES, EN EL ÍNDICE DE LA PÁGINA 74, 
;20211206.jpg;Un toque de atención para la solución argentina de los problemas argentinos  ClarínX  BUENOS AIRES, ARGENTINA PRECIO: $130.00  Gestión en Washington NEGOCIACIÓN CON EL FONDO  Presionado porlapérdida — enisoposicón o sobre el apovo a de reservas, el Gobierno Fernández  Sectores dela Coalición Cívica están de acuerdo en avalar un posible programa, por responsabilidad política. Algunos del PRO plantean ponercondiciones. Un referente definió el dilema que seles presenta: “Oposición responsableoidiotas útiles” Temen caeren una trampa tendida porel Gobierno.p1o  apura un acuerdo con el FMI  discuten el déficit fiscal, la enorme brecha cambiaria y la inflación descontrolada. Pese a la urgencia del Gobierno, se cree queel acuerdo no llegaría este año. La negociación seguirá en enero. pg  queel Banco Central, hacia fin de año, se quedaría con apenas US$3 mil millonesen reservas y debe afrontar pagos por más de US$ 5 mil millones de acá a marzo. En la agenda con el FMI se  La misión de técnicos de Economía y del Banco Central llegó ayer y ya a la tarde sereunió con funcionarios del Fondo en la embajada argentina. El apuro por cerrar un acuerdo obedecea  e ss La hora deladiós. A pura emoción, después del partido, Ponzio se despide de la hinchada. $  MAXIFAILLA  River, sin invicto, despidió contodo a Ponzio  El resultado fue lo de menos: el público del campeón le dijo adiós a su ídolo en la derrota por 3-2 ante Defensa, que le sacó un invicto de 18 partidos. En una noche donde sobró la emoción, la gente pidió también por la continuidad de Gallardo. peporTIVO  FIN DE SEMANA SANGRIENTO  Violencia narco sin control en Rosario, con cuatro muertos y extorsiones  Una pareja apareció asesinada en un descampado, un hombre fue acribillado junto a las vías del tren y un joven fue muerto a tiros en un ataque. Hubo ocho disparos al local de una empresa agropecuaria con un mensaje de Los Monos: “100 mil por mes o los matamos a todos”. P.30  TIENE 38 AÑOS Y VIVE EN SAN LUIS  Detectan el primer caso de ómicron enla Argentina  Volvió el 30 de Sudáfrica y dio negativo en Ezeiza. Estaba aislado en su casa. Un nuevo test fue posi tivo. Tuvo Covid en marzo y esquema de vacunación completo. p.32  MOVIDA DEL PRESIDENTE Perú: Castillo convocaalos  partidos para frenar  su destitución  A cuatro meses de su asunción, el presidente Pedro Castillo está en lacuerda floja. Por un pedido de “vacancia”, figuTa legal por la cual el Congreso puede solicitar su destitución silo considera incapacitado para gobernar, el mandatario afronta una votación clave en el Parlamento. Para evitar su expulsión,  Castillo convocó para hoy aun diálogo con todos los partidos con representación en la Cámara. Perú tiene una tradición de destitución de presidentes: uno en 2018 y otro en 2020. Sin mayoría proPia, Castillo viene atravesando una crisistras otra, después de un ajustado balotaje con Keiko Fujimori. P3  DelaEditora  Silvia Fesquet  Sigue siendo la educación, estúpidos  14  REPUBLICA ARGENTINA, AÑO LXXVIN' 27.304 RECARGO ENVIO AL INTERIOR: $ 30,00 PRECIO DE LOS OPCIONALES, EN EL ÍNDICE DE LA PÁGINA 46. 
