;20220303.jpg;Un toque de atención para la solución argentina de los problemas argentinos  BUENOS AIRES, ARGENTINA PRECIO: $ 150,00  Tema del día o La invasión a Ucrania  Rusia redobla su ataque a Kiev y está cada vez más aislada en el mundo  Las duras sanciones económicas, el cierre deespacios aéreos y las medidas contra susactivos ya se hacen sentiren la vida co al cumplirse la primera semana de invasión. El gobiernoruso, que volvió a lanzar una amenaza nuclear, admitió que ya su enUcrania  Condena en la ONU a  PABLO VACAENVIADO ESPECIAL  tidiana de Rusia, que ayer recibió otra frió 500 muertos, Anoche, en Bielorrusia, Contra la invasión con “ro .” fuerte condena en la ONU. Por orden de se aguardaba una segunda reunión de nelos votos d e 141 países Listo para morir, Putin, las fuerzas rusas volvieron aatacar  gociaciónconlos representantes ucrania, el miliciano francés  Kievy las principales ciudades ucranianas nos. Crece la indignación mundial. p.3 entre ellos Argentina.  AFP  Destrucción. Con misiles y tanques, sobre la Central de Policía de Járkov.  LA PELEA POR LA DEUDA  PALERMO Sergio Massa informó oficialmente que e é ini El Gobierno envía el proyecto ingresa hoy a la Cámara de Las camaras revelan Hear Gampial Diputados y citó alos bloques para em1 e el acuerdo con el pezar a debatirlo en la comisión de Preel ataque sexual La UTUPcIón de los supuesto. La posición frente al acuerdo Lo captaron videos de la Policía y de violadores menos FMI al Congreso sigue abriendo grietas en el oficialismo los comercios. Declaró la víctima. ensados yen la oposición y aún no hay previsioOtra mujer acusó a uno de los seis p y se abre el debate nes seguras sobre la votación. P.18 detenidos por un abuso anterior. P.32 P.2  REPUBLICA ARGENTINA, AÑO LXXVIN' 27.389 PRECIO EN C.A.B.A. Y GBA CON ZONAL: $ 165,00 RECARGO ENVIO AL INTERIOR: $ 30,00 PRECIO DE LOS OPCIONALES, EN EL ÍNDICE DE LA PÁGINA 58, 
;20220304.jpg;Un toque de atención para  la solución argentina de los  problemas argentinos  d rl n SY BUENOS AIRES, ARGENTINA PRECIO: $150,00  La negociación por la deuda  Acuerdo con el EMI: fuerte aumento de tarifas y sigue el cepo cambiario  Proyecto con dudas  El Fondo Monetario Internacionalyel gía, loque obligará a aumentar las ta Gobierno anunciaron que llegaron a rifas de luz y gas de un 22% hasta un ES a Z a Miri  un acuerdo técnico para instrumen200% para los usuarios con mayores El G bi  tar un programa económico con un ingresos. El Fondo también dijo que el . obIerno mostró en nuevo préstamo de US$ 45.000 millo ceposeguirá mientras el Banco CenEl bloqueo inestable el Congreso un texto nes para pagar el crédito que habíatotral tenga pocas reservas y que laininiali  mado Macri. El Gobierno se comproflación oscilará entre el 38% y 48% en del oficialismo rl el AN L pero luego mete areducirlos subsidiosa laener esteaño.p.18 y la Oposición Jo que lo CamDiara.  La interna del Gobierno, al rojo El Presidente se juntó con Kicillof, pero La Cámpora castigó el acuerdo.  nn — ay  LA INVASION A UCRANIA.  Pese al alto el fuego, Rusia atacó una planta nuclear  Los misiles alcanzaron la mayor central nuclear europea en Zaporiyia, al sur de Ucrania. Fue pocas horas después de que se acordara un alto el fuego para permitir corredores humanitarios cuando ya hay 2 millones de refugiados. "La ofensiva seguirá sin concesiones”, afirmó Putin. tema DEL DíA  “Lo peor está por venir”  Lo dijo un asesor de Macron, tras el diálogo del presidente francés con el líder ruso.  €) Clarínenun centro dereclutamiento  PABLO VACA ENVIADO ESPECIAL  “Todos podemos combatir”  REPUBLICA ARGENTINA, AÑO LXXVIN' 27.380 RECARGO ENVIO AL INTERIOR, $ 30,00 PRECIO DE LOS OPCIONALES, EN EL ÍNDICE DE LA PÁGINA 58. 
;20220305.jpg;Otra  literatura  juvenil sms  Serenueva p%1EcO A 2  la mirada IN] ES  Envían al Congreso los detalles del arreglo  FMI: al Gobierno se le complica la interna y busca otros apoyos  La Casa Rosada cedió a un pedido de la oposición y separó en el proyecto de ley la autorización del Congreso para que el Gobierno pueda tomar el crédito del  guirelvoto de diputados de Juntos por el Cambio, porque las diferencias del Presidente con el kirchnerismo son cada vez más grandes. Máximo Kirchner  Un acuerdo que nadie  quiere salir a defender El entendimiento con el  FMI, delos detalles del programa econóvolvió a publicar en las redes un video o af ss mico que acordó Martín Guzmán conel. de La Cámpora muy duro contra el arreFMI es criticado por los Cristina y Alberto: organismo. Lo hizo para tratardeconse gloalcanzado por el Gobierno. p.24 políticos y por el mercado. Lo peor esta por venir  a LA INVASIÓN AUCRANIA? %, jaa x  Temor en-, / Europa porel /( ataque ruso a la centralnucléar  hubo escapes radioactivos de la  ta de Zaporiyia, donde cayeronlo! proyectiles rusos, hay repudio mi  dial y alarma por un incidente:  co. Es la mayor central europ:  ahora quedó en poder delosi,  res. La ONU investigará al régimen de Putin por violación a los derechos humanos. TEMA DELDÍA  PABLO VACA ENVIADO ESPECIAL “Necesitamos que la gente se quede” $  Desesperación. La salida, desde la estación de Lviv.  dDe  REPÚBLICA ARGENTINA, AÑO LXXVI, N' 27.391 RECARGO ENVÍO AL INTERIOR: $ 30, 00 PRECIOS DE LOS OPCIONALES, EN EL ÍNDICE DE LA PÁGINA 58,  
;20220306.jpg;Abrazos. Todos con Paulo Díaz, autor del 1-0. ante San Lorenzo. River]  está arriba en su zona.  "prime V8éS Primed 7 y]  Prime vide? —  Enredos sexuales por las redes  VIVA  Duro documento del PRO antes del debate en el Congreso  Reunión clave de la oposición para definir si vota el acuerdo con el FMI  La Mesa Nacional de Juntos por el Cambio intenta consensuar hoy su posición. El ala más dura del PRO, con referencia en Macri, sepronunció en contra del acuerdo, mientras que el ti tular de la UCR, Gerardo Morales, y la Coalición Cívica consideran que la prioridad es que el país no caiga en default. En el oficialismo, también muy dividido, el ministro Wado de Pe dro -el funcionario más cercano a Cristina Kirchnerdijo desde España que el acuerdo “es el comienzo de la solución y evita una catástrofe”. Guzmán va mañana al Congreso. p.30  Fernández, entre el FMI yla presión de Macri y Máximo  a = Destrucción. El puente Ls A de Irpin fue alcanzado  por los misiles rusos. La  caravana del dolor, por  un camino alternativo.  ARIS MESSINIS / AFP  LA INVASION RUSA  asdé Occidente porsu inyási  el Vesrtapdra: la cafe  Julio Algañaraz, Ktusa, Tdafe Martin  REPÚBLICA ARGENTINA, AÑO LXXVI, N' 27.392 RECARGO ENVÍO AL INTERIOR: $ 30,00 PRECIO DE LOS OPCIONALES, EN EL ÍNDICE DE LA PÁGINA 74. 
;20220307.jpg;ClarínX  Un toque de atención para la solución argentina de los problemas argentinos  BUENOS AIRES, ARGENTINA PRECIO: $150.00  THE NEW YORK TIMES  El horror. Soldados ucranianos intentan salvar al padre, único con vida de una familia de cuatro que intentaba huir de Kiev.  Tema del día e La guerra en Ucrania  Denuncian que Rusia busca sembrar el terror y atacaala población civil  Las autoridades ucranianas y el secretario de Estado de EE.UU., Antony Blinken, aseguraron tenerinformes creíbles que lo demuestran y que se trataTía de crímenes de guerra. El funcionario recordó que el presidente Biden había acusado a Rusia de estar bombardeandoa la población intencionadamente. Moscú lo desmiente. En un diá logo con el presidente francés Emmanuel Macron, Putin dijo que alcanzará sus objetivos “ya sea mediante la negociación o la guerra”. El presidente ucraniano Volodimir Zelenski afirmó que las tropas rusas se aprestaban a atacar elestratégico puerto de Odesa. Hoy se hará la tercera ronda de negociaciones entre rusos y ucranianos. P.3  E CiarinenUcrania pu  PABLO VACA ENVIADO ESPECIAL “Seis veces peor que Chernobyl”  Así podría ser, según el alcalde deRivne, un potencial ataque asu central nuclear  ¿Boicot al gas y al petróleo rusos? EE.UU. y la UE analizan cortar las compras  NEGOCIACIÓN CON EL FONDO  Sin acuerdo sobre cómo votar, la oposición coincide sólo en no empujar al default  Una reunión virtual de la Mesa nacional de Juntos por el Cambio no logró alcanzar consenso acerca de cómo votar el acuerdo con el FMI. Sí dejaron en claro que no bloquearán la aprobación y que rechazan el programa económico. Así selo plantearán hoy a Guzmán, cuando asista a Diputadosjunto a Juan Manzur y Miguel Pesce. p.18  Guzmán pide apoyo En visita inesperada a diputados del bloque, por el acuerdo con el FMI  Relevo por votos  Para asegurar dictamen a favor, el FAT reemplaza a diputados K en Presupuesto  VIOLACIÓN EN PALERMO  Dostestigos complican más alos acusados  Uno contó que vio cómo se produjo el abuso de la chica dentro del auto. Y otro declaró que los jóvenes fue ron a agredirlo porque pensaban que los estaba filmando. p.34  Dela Editora  Silvia Fesquet  Alberto F., sinrumboy con fuego amigo  P.2  REPÚBLICA ARGENTINA, AÑO LXXVI, N' 27.393 RECARGO ENVÍO AL INTERIOR: $ 30,00 PRECIO DE LOS OPCIONALES, EN EL ÍNDICE DE LA PÁGINA 50. 
;20220308.jpg;Arranque. Con De Pedro, Domínguez y Perotti.  positdras.p.3o  Kulfas, también presente. Y  Un toque de atención para la solución argentina de los problemas argentinos  REUTERS  Otra cara del drama. Una madre despide a sus hijas de 12 y 6 años, que abandonan Odesa en busca de un destino más seguro.  Tema del día e Doce días de guerra  Ucrania rechazó el ultimátum de Putin y se combate cuerpo a cuerpo cerca de Kiev  pidieron estas salidas. Hasta ayer, ¡ €) ClarínenUcrania | según la ONU, había ya 1,7 millón de PABLO VACA -ENVIADO ESPECIAL  refugiados. La UE abrió una ventaD naal ingreso de Ucrania al bloque, e catacumbas a refugios antibombas  un proceso que tomará su tiempo. El probable embargo de la producEnLviv la ciudad quese prepara para ser capital de la resistencia  ción petrolera rusa provocó un saltoen los precios de la energía. p.3  El presidente ucraniano Volodimir Zelenski impugnó las tres exigencias básicas del Kremlin para terminar “en cualquier momento” la guerra. Fue luego de la tercera ronda de negociaciones para establecer corredores humanitarios para evacuara civiles. Los bombardeos im Guiño de EE.UU. a Maduro ¿Menos sanciones a cambio de petróleo?  EL RIESGO PAÍS ROZÓ LOS 2.000 PUNTOS Guzmánno convenció y  la oposición amenaza con un proyecto propio  El ministro estuvo ayer en las comisiones de Presupuesto y Finanzas en Diputados. Advirtió sobre una “potencial desestabilización” si no se aprueba el acuerdo con el FMI. Juntos por el Cambio exige modificarla letra del proyecto ya que no avala el programa económico. Y podría presentar un proyecto propio. El mercado reaccionó con caída de bonos y acciones. p.20  Tarifas para ingresos altos  El ministro no garantiza que el tope sea del 200%  ANUNCIO DE MARCÓ DEL PONT  La AFIP multiplicará por cuatro la valuación fiscal de propiedades en Ciudad  La jefa del organismo dijo que la medida se implementará en los próximos días. Los nuevos valores tendrán impacto en el ABL y en Bienes Personales. p.23  LA EMPRESA INVESTIGA EL ATAQUE  Hackean 300 mil cuentas de Mercado Libre  Un comunicado oficial dice que no serobaron claves niotros datos sensibles de los usuarios. El hackeo lo hizo el grupo Lapsus. P.38  LE SACÓ $ 200.000 A CAMBIO DE SILENCIO  Presa por extorsionara su íntima amiga infiel La detuvieron cuando iba a cobrar el botín,  en el baño de una estación de servicio. Podrían darle entre 5 y 10 años de cárcel. p.45  REPÚBLICA ARGENTINA, AÑO LXXVI, N' 27.394 RECARGO ENVÍO AL INTERIOR: $ 30,00 PRECIO DE LOS OPCIONALES, EN EL ÍNDICE DE LA PÁGINA 62 
;20220309.jpg;ClarínX  Un toque de atención para la solución argentina de los problemas argentinos  BUENOS AIRES, ARGENTINA PRECIO: $ 150,00  Tema del día + Más presión internacional sobre Rusia  Invasión a Ucrania: Biden prohíbe la compra de petróleo y gas rusos, y Putin impone un cepo cambiario  En otra medida de endurecimiento frente al régimen ruso, el presidente de EE.UU. prohibió la importación de petróleo y gas. Shell dejará de comprar en  que tendrá EE.UU., aligerando acambio las sanciones contra su gobierno. Anteel agravamiento de la situación interna, mientras no cede su ofensiva  A DelEditor |  Ricardo Roa  6) Clarínen Ucrania  PABLO VACAENVIADO ESPECIAL  Rusia, además de cerrarallísus500es bélicaen Ucrania, Putin impuso un coPor qué El clamor de 500 mil taciones de servicio. En Venezuela, rralito y un cepo: no se pueden comú G 5 ¡ Maduro confirmó que una delegación  prardivisas extranjeras por seis meses Putin es Putin chicos quequieren estadounidense lo sondeó para quesu en Rusia y sólo permiten retirar hasta volvera casa país pueda cubrir el faltante de energía  US$10 mildelos bancos. p.3 P.2 EMMANUEL FERNANDEZ JOSÉ C. PAZ Ñ Unnuevo8M. Y el recordatorio de , IN 300 mujeres asesinadas cada año. Alberto E. lanzó su , reelecciónenun acto con elogios a  LAMA  Contra los femicidios y porla igualdad  Fueron dos de los principales reclamos que miles llevaron al Congreso en el Día Internacional de la Mujer. Con familiares de víctimas se pidió por el fin de la violencia de género. “Que ser mujer no nos cueste la vida”, se lefa en uno de los carteles. p.36  Ishii y a Cristina  “En este primer mandato que tengo”, dijo el Presidente al hacer unanuncio. Celebró “el coraje” de Cristina en su presidencia y destacó al intendenteIshii, que les pidió “no sean traidores” alos legisladores K queestánen contra del acuerdo con el FMI. p.29  ACUERDO CON EL FONDO  El Gobierno acepta retocar el proyecto, pero no conforma ala oposición  Sergio Massa admitió que, aunque Guzmán tiene reparos, analizan el pedido de Juntos por el Cambio de reformular el texto del proyecto.  El Ejecutivo pide a cambio un acompañamiento masivo. Pero esto genera reticencia en la oposición. p.22  REPÚBLICA ARGENTINA, AÑO LXXVI, N' 27.395 RECARGO ENVÍO AL INTERIOR: $ 30, 00 PRECIOS DE LOS OPCIONALES, EN EL ÍNDICE DE LA PÁGINA 62, 
;20220310.jpg;Benzema hundió al PSG  En 17 minutos, el francés aprovechó todos los errores y marcó los 3 goles para eliminar al equipo de Messi. r.4s  > Siga EY  Un toque de atención para la solución argentina de los problemas argentinos  BUENOS AIRES, ARGENTINA PRECIO: $ 150,00  Despuésde más de unsiglo,  ¿hallan unlegendario barco El "Endurance" naufragó  en la Antártida en 1915. pss  Tema del día + Negociaciones clave por la deuda  La oposición hizo ceder al Gobierno y apruebanla refinanciación con el FMI  Alberto Fernández debió ceder ante la exigencia de los diputados de Juntos por el Cambio. El oficialismo terminó limitando el texto del proyecto de ley del acuerdo con el Fondo, ala aprobación de un préstamo. Pero no habrá un avala las medidas que adoptará el Gobierno para cumplircon las metas fis Cales que le exige el FMI. Tras arduas negociaciones entre Sergio Massa y los jefes de los bloques del PRO, la UCR y la Coalición Cívica, anoche consensuaron un dictamen que será votado hoy en la Cámara de Diputados. Luego deberá ser aprobado por el Senado, que maneja Cristina Kirchner. p.3  EA INVASIÓN RUSA LLEVADOSSEMANAS  Crucial negociación para. frenar la guerra en  Los cancilleres se reúnen hoy en Antal  de ese país, Erdogán. Los'ataq|  Gonzalo Abascal 27 2 e 1 LaBuerra informativa que qa perdió Putin: Pa  , Tufquí  AR rusó$mg ceder y ayér: cd  l infantiles Marjúpol  No avalan el acuerdo, endurecen sus críticas y ahora la incógnita  es cómo votarán.  El ministro había pedido que no se cambiaran los artículos. Viajó a EE.UU.  por un evento energético  —— 1.00  El drama. Socorristas, con una embarazada herida junto al hospital infantil destruido.  REPUBLICA ARGENTINA, AÑO LXXVIN' 27.396 PRECIO EN C.A.B.A. Y GBA CON ZONAL: $ 165,00 RECARGO ENVIO AL INTERIOR: $ 30,00 PRECIO DE LOS OPCIONALES, EN EL ÍNDICE DE LA PÁGINA 62 
;20220311.jpg;ClarínX  Tema del día e Se votaba esta madrugada  Diputados aprue  Un toque de atención para la solución argentina de los problemas argentinos  BUENOS AIRES, ARGENTINA PRECIO: $ 150,00  ba por amplia  mayoría el acuerdo con el FMI  Sin cruces, y al cabo de más de diez horas de debate, la Cámara votabaa favor dela refinanciación del préstamo con el Fondo. Juntos porel Cambio lo aprobó después de que el Gobierno accediera a modificar el texto original. López Murphy adelantó queno lo votaría, y lo mismo hicieron Milei y Espert. El Frente de Todos se mostró dividido. Máximo Kirchner y los principales cristinistas no dieron quórum, hasta último momento no bajaron al recinto y mantuvieron en reserva su posición. Violentas protestas de grupos deizquierda con piedras, bombas molotovy varios policías heridos. Rompieron vidrios del despacho de Cristina. p.3  Polémica por la tardía acción de la Policía  Rodríguez Larreta dijo que, desde el Gobierno nacional, se le exige a Ciudad que no ponga vallas en las protestas.  Ignacio Miri  Las diferencias que esconde el voto similar »2  LUCÍA MERLE  YN  Violencia inusitada. Un policía, herido en una pierna por la bomba molotov que lanzó uno de los manifestantes frente al Congreso.  FRACASÓ LA CUMBRE DE CANCILLERES RUSO-UCRANIANA  Sin un acuerdo para el alto el fuego, los tanques de Moscú rodean Kiev  “Ucrania no se rinde ni se rendirá”,  Sergei Lavrov insistió en que son to de Putin no cede en su ofensiva  dijo su canciller Dimytro Kuleva al “irreversibles” las tomas de en varias regiones ucranianas. concluir la mediación turca en el Crimea y la región del Donbás. Pietro Parolin, secretario de balneario de Antalya. Pero los Ucrania aceptaría un papel neuEstado del Vaticano, habló con blindados rusos ya cercaron la tral frente a la OTAN, algo que exi Lavrov y concluyó: “Ahora es una capital ucraniana, al cumplirse gen los rusos. Las negociaciones guerra sin cuartel”. Lavrov no elu dos semanas de la invasión, amepara un eventual alto el fuego se dió la responsabilidad rusa en el nazando los bastiones del gobier retomarán en los próximos díasen brutal ataque a la maternidad de no de Zelenski. El canciller ruso Bielorrusia, mientras que el ejérciMariúpol. p.22  PABLO VACA ENVIADO ESPECIAL Grieta: ucranianos que yano sehablan con parientes rusos  El drama de familias enfrentadas por la invasión. p.26  LO DIJO LA VICE KAMALA HARRIS EE.UU. pide investigara Putin por crímenes de guerra  Fue después del bombardeo a civiles y al hospital materno de Mariúpol. p.25  REPUBLICA ARGENTINA, AÑO LXXVIN' 27.397 RECARGO ENVÍO AL INTERIOR: $ 30,00 PRECIO DE LOS OPCIONALES EN EL ÍNDICE DE LA PÁGINA 62 
;20220312.jpg;to Yentey 1. Y DelPrete Los lazos y 1/ entreelarte ss 4 y la vida  El acuerdo con el Fondo  En el Senado, el oficialismo también votará dividido y necesitará ayuda opositora  Con un tercio del bloque del Frente de Todos en contra y el apoyo casi monolítico de Juntos por el Cambio, la Cámara de Diputados aprobó la autorización para que Alberto Fernández pueda tomar el crédito de US$ 45.000 millones  quele solicitó al FMI. Desde el lunes, el proyecto será tratado en el Senado, dondeel kirchnerismo también se opondrá y el Gobierno volverá a depender del voto de Juntos por el Cambio para obtener la ley que necesita.p.4  Del Editor Ricardo Roa  ¿Al fin Fernández agarrará la lapicera?  MAA =  ES RS 0  Ahora la invasión rusa se extiende hasta el oeste  ALEXANDER EMOCHENKO / REUTERS  Sin tregua. Los tanques rusos en los edificios de Volnovakha, región del Dónetsk.  e 5 E ES  Por primera vez, aviones y artillería del Ejército de Putin atacaron las ciudades del occidente ucraniano, a menos de 100 km. de Polonia, país miembro de la OTAN. Sigue en asedio a Kiev. Joe Biden anunció más represalias económicas sobre Rusia p.24  VIDEO DE LA VICEPRESIDENTA  Cristina criticó al Fondo y asumió la posición que tiene Máximo  La vice mostró los daños de los piedrazos que sufrió su despacho en la marcha del jueves contra el FMI. No condenó a quienes la atacaron, criticó al organismo que está extendiendo un préstamo al Gobierno y se acercó a la posición de su hijo, que votó en contra del acuerdo.p.6  Suben los mercados  Tras la votación en Diputados, bajaron el dólar financiero y el riesgo país.  ACUSADOS POR LA PROCELAC  Indagaránalos hijos deljuez Bento porlavado de dinero  Fueron imputados por blanquear fondos de supuesto origen ilícito que manejó su padre, el juez federal de Mendoza. Este ya fue acusado de corrupción y de favorecer a presos. p.14  EL CASO EN PALERMO  Más acusaciones por el ataque sexual  Agravan la imputación contra los seis detenidos, a quienes les atribuyen un “plan” para abusar de su víctima, unajoven de 20 años. p.46  REPÚBLICA ARGENTINA, AÑO LXXVI N' 27. 398 RECARGO ENVÍO AL INTERIOR: $ 30,00 PRECIO DE LOS OPCIONALES, EN EL ÍNDICE DE LA PÁGINA 58. 
;20220313.jpg;Implacable  Triplete de Cristiano con  807 en su carrera, el máximo goleado! en juegos oficiale:  Rugby femenino  2  FA] Una expansión  sin prejuicios  VIVA  Fricciones entre el kirchnerismo y la Casa Rosada  Para Aníbal las pedradas  ala oficina de Cristina fueron intencionales  pacho de Cristina durante la marcha al Congreso contra el FMI. Fueen el marco de los cruces entre el Gobierno y el kirchnerismo, que votó en contra del acuerdo en Diputados. -.8  El ministro de Seguridad dijo que lo deducía por su experiencia, pero reconoció que“no hay evidencias”. Desde La Cámpora cuestionaron que el Ejecutivo no repudiara el ataque al des La pelea  deCristina y Alberto sostieneal tambaleante Guzmán  MERCADOS DISTORSIONADOS  Pagan hasta  $ 3 millones de sobreprecio por unO0km para evitar demoras  Los compradores que no quieren esperar seis meses la entrega de su auto, aceptan ese sobrecosto. La alternativa es pagar la reserva pero sin poder cerrar el precio final, porque los autos están aumentando entre 4% y 5% mensual. El BCRA regula los dólares para importarlos. p.22  LA INVASION RUSA  NA Macronacusáa Putin de insistir” en su escalada, ,  Rusia bombardea suburbios de cd ucraniana y Putin amenazó con destruirlos convoyes con armas: occidentales. El presi dente francés y el canciller alemán volvie1 areclamarleal líderruso un alto. elfuego.  A  Antony Beevor, John Carlin,  arín PABLO VACA ENVIADO ESPECIAL  Un enfrentamiento que se extiende a las iglesia  REUTERS  de Kiev. sj  REPÚBLICA ARGENTINA, AÑO LXXVI, N' 27.399 RECARGO ENVÍO AL INTERIOR: $ 30,00 PRECIOS DE LOS OPCIONALES, EN EL ÍNDICE DE LA PÁGINA 70. 
;20220314.jpg;ClarínX.  Un toque de atención para la solución argentina de los problemas argentinos  BUENOS AIRES, ARGENTINA PRECIO: $150.00  Sorpresiva medida y malestar de los productores  Apriete al campo: cierran exportaciones de soja y subirían las retenciones  Ladecisión afecta a la harina y el aceite, el 80% de las exportaciones de soja. Las retenciones subirían 3 puntos, y arrimarían unos US$ 700 millones extra al Go bierno. Desdeel oficialismo dicen que es para subsidiar el consumo interno de trigo, cuyo precio se multiplicó porlainvasión a Ucrania. Pero en el campo te men que suban las retenciones a otros productos. Hubo una rápida y dura reacción dela oposición y deoficialistas comoel gobernador Omar Perotti. p.22  Aumenta 9,5% la nafta Desde hoy, y es la segunda suba en lo que va del año  THE NEW YORK TIMES  2% Enllamas. Uno de los edificios de la base de Yavoriv, atacada ayer.  CRECE LA OFENSIVA Con el bombardeo a una base militar, Rusia lleva la guerra a la frontera con la OTAN  nos 35 muertos y más de 130 heridos. ucraniana y alcance a alguno de sus  Esla primera vez que Putin lleva las acciones a la región de Lviv, considerada la capital alternativa de Ucrania. EE.UU. advirtió al gobierno ruso que la OTAN responderá con fuerza cualquier ataque que vaya más allá de tierra  PABLO VACA-ENVIADO ESPECIAL  Las fuerzas del Kremlin dispararon misiles contra la base de Yavoriv, en el oeste ucraniano y aescasos 25 kilómetros del límite con Polonia. Hubo al me miembros. Un periodista estadounidense fue asesinado de un disparoen la nuca mientras circulaba en auto en  las afueras de Kiev. Hoy se hará la cuar taronda de negociaciones, esta vez por videoconferencia. TEMADEL DÍA P.3  LA PELEA CON FERNÁNDEZ Por presión de gobernadores, Cristina secorre dela votación enel Senado  El acuerdo con el FMI marcará la primera vez que buena parte de los senadores peronistas votará en líneacon las necesidades del Gobierno y noen sintonía con lavicepresidenta. Losgobernadoresimponen así su apoyo al Presidente. Hoy, en medio de cuestionamientos, va Guzmán al Senado.P.16  CORRUPCIÓN K  Nuevas pruebas revelan beneficios aLázaro Báez en la obra pública  Un informe con detalles sobre las51 licitaciones que ganóel Grupo Austral saca a luz más irregularidades. Incorporado en el juicio, amenaza con complicar más la situación de Cristina Kirchner y del empresario K.p.24  El Personaje  WILLIAM HURT  Un actor versátil y carismático  Filmó “El beso dela mujer araña” y en Buenos Aires “La peste” con Luis Puenzo. Murió alos71años.p.44  Silvia Fesquet De Hitler a Putin, cómo se construye un dictador ».  REPUBLICA ARGENTINA, AÑO LXXVI N' 27.400 RECARGO ENVÍO AL INTERIOR: $ 30,00 PRECIOS DE LOS OPCIONALES, EN EL ÍNDICE DE LA PÁGINA 50, 
